page.iht.application.exemptions.qualifyingBody.name.browserTitle	Body name		Unchanged.
site.pdf.document.link.text	PDF document	Dogfen PDF	Unchanged.
page.iht.application.debts.other.inputLabel1	Value of any other debts		Unchanged.
page.iht.registration.deceasedDetails.maritalStatus.civilPartnership.hint	The deceased was married or in a civil partnership when they died.	Roedd yr ymadawedig yn briod neu mewn partneriaeth sifil pan fu farw.	Unchanged.
error.dateOfMarriage.giveCorrectDateUsingOnlyNumbers	Give a correct date of marriage only using numbers	Rhowch ddyddiad cywir ar gyfer priodi gan ddefnyddio rhifau'n unig	Unchanged.
page.iht.application.exemptions.overview.qualifyingBody.detailsOverview.value.link.screenreader.noValue	Give value of assets received by the qualifying body		Unchanged.
iht.dateExample2	For example, 21 3 1990	Er enghraifft, 21 3 1990	Unchanged.
page.iht.application.exemptions.partner.dateOfBirth	Date of birth of spouse or civil partner		Unchanged.
page.iht.registration.applicantAddress.hint	This is where HMRC can contact you.	Dyma lle gall CThEM gysylltu â chi.	Unchanged.
page.iht.application.overview.debts.screenReader.value.link	View or change debts owed from the estate		Unchanged.
page.iht.sign-out.title	You have signed out		Unchanged.
page.iht.registration.deceasedDetails.maritalStatus.civilPartner.label	Divorced or a former civil partner	Wedi ysgaru neu'n gyn-bartner sifil	Unchanged.
page.iht.registration.checklist.exec.title	If anyone else is applying to the Probate Service for a grant of representation for the estate, you will need their:		Unchanged.
page.iht.registration.registrationSummary.applicantInfo.email.data.screenReader	Your email address is {0}	{0} yw eich cyfeiriad e-bost	Unchanged.
page.iht.registration.registrationSummary.applicantInfo.address.data.screenReader	Your address is {0}	{0} yw eich cyfeiriad	Unchanged.
error.nino.blank.summary	enter a National Insurance number	nodwch rif Yswiriant Gwladol	Unchanged.
page.iht.registration.checklist.exec.reveal.label3	The phone number given is one that HMRC can contact this person on. This might happen after you have finished the estate report and it is being reviewed.	Y rhif ffôn a roddwch yw'r un y gall CThEM gysylltu â'r person hwnnw arno. Gallai hynny ddigwydd ar ôl i chi orffen adroddiad yr ystâd a'i fod yn cael ei adolygu.	Unchanged.
error.jointlyOwned.currencyValue.length.summary	enter a value for debts owed on joint assets using less than 11 numbers	nodwch werth ar gyfer dyledion sy'n ddyledus ar asedion ar y cyd gan ddefnyddio llai nag 11 rhif	Unchanged.
page.iht.application.qualifyingbodies.delete.screenReader	Delete {0} (qualifying body {1}) from your list of qualifying bodies		Unchanged.
page.iht.iv.failure.technicalIssue.p1	This online service is experiencing technical difficulties.		Unchanged.
page.iht.application.overview.gifts.nonGiven	No gifts given		Unchanged.
iht.registration.ninoNotOnPayslip	Their National Insurance number can be found on a payslip, a P45 or a P60 form.	Gellir dod o hyd i'w rif Yswiriant Gwladol ar slip cyflog, P45 neu ffurflen P60.	Unchanged.
page.iht.application.exemptions.overview.partner.screenReader.link.value	Change the answer for assets left to a spouse or civil partner		Unchanged.
error.date.blank	Enter a date	Nodwch ddyddiad	Unchanged.
error.length.giftsDetails.value.summary	enter a value for other gifts using less than 11 numbers	nodwch werth ar gyfer rhoddion eraill gan ddefnyddio llai nag 11 rhif	Unchanged.
page.iht.application.overview.time.limit1	You have until		Unchanged.
error.vehicles.currencyValue.length.summary	enter a value for motor vehicles using less than 11 numbers	nodwch werth ar gyfer cerbydau modur gan ddefnyddio llai nag 11 rhif	Unchanged.
page.iht.registration.registrationSummary.applicantInfo.country.link.screenReader	Change where you are applying for probate		Unchanged.
page.iht.application.debts.debtsTrust.isOwned	Are there any debts being paid out of the estate that are owed from a trust that {0} benefitted from?		Unchanged.
iht.countries.englandOrWales	England or Wales	Cymru neu Lloegr	Unchanged.
iht.estateReport.debts.debtsTrust.title	Debts owed from a trust		Unchanged.
page.iht.iv.failure.preconditionFailed.p1.link.text	Contact HMRC to get help		Unchanged.
iht.lastName	Last name	Enw olaf	Unchanged.
page.iht.home.button.viewApplication.label	View		Unchanged.
page.iht.application.qualifyingbodies.add.title	Assets left to another qualifying body		Unchanged.
site.application.title	Complete an estate report	Llenwi adroddiad ystâd	Unchanged.
page.iht.application.overview.inreview.helptext	It could take HMRC up to 2 months to review this estate report from the date you sent it. HMRC will contact you if they have any questions about this estate report.		Unchanged.
error.giftsGivenAway.select	Select an answer for if more than £3,000 was gifted away in any of the 7 years before death	Dewiswch ateb ar gyfer os rhoddwyd mwy na £3,000 i ffwrdd yn ystod unrhyw un o'r 7 mlynedd cyn marwolaeth	Unchanged.
page.iht.registration.deceasedDetails.title.hint	Enter Mr, Mrs, Miss, Ms or other title	Nodwch Mr, Mrs, Miss, Ms neu deitl arall	Unchanged.
page.iht.registration.notApplyingForProbate.kickout.p2 = If you want to change your answer	you can return to the last page you visited.	gallwch ddychwelyd i'r dudalen ddiwethaf y gwnaethoch ymweld â hi.	Unchanged.
error.debtsOutsideUk.currencyValue.summary	enter a value for debts owed outside of the UK using only numbers	nodwch werth ar gyfer dyledion sy'n ddyledus y tu allan i'r DU gan ddefnyddio rhifau'n unig	Unchanged.
iht.estateReport.exemptions.charities.registeredCharityNo	Registered charity number		Unchanged.
page.iht.application.exemptions.guidance.increasing.threshold.title	The estate value is above the Inheritance Tax threshold		Unchanged.
error.dateOfDeath.giveCorrectDateUsingOnlyNumbers	Give a correct date of death only using numbers	Rhowch ddyddiad cywir ar gyfer y farwolaeth gan ddefnyddio rhifau'n unig	Unchanged.
page.iht.iv.failure.lockedOut.title	Maximum number of attempts reached		Unchanged.
page.iht.registration.checklist.revealText	How to find these details	Sut i ddod o hyd i'r manylion hyn	Unchanged.
page.iht.application.overview.exemptions.screenReader.noValue.link	Start giving details about estate exemptions		Unchanged.
error.heldInTrust.currencyValue.length.summary	enter a value for assets in a trust using less than 11 numbers	nodwch werth ar gyfer asedion mewn ymddiriedolaeth gan ddefnyddio llai nag 11 rhif	Unchanged.
page.iht.registration.deceasedDetails.maritalStatus.civilPartnership.label	Married or in a civil partnership	Yn briod neu mewn partneriaeth sifil	Unchanged.
iht.iv.tryAgainLater	Please try again in 5 minutes.	Rhowch gynnig arall arni mewn 5 munud.	Unchanged.
iht.estateReport.exemptions.qualifyingBodies.assetsLeftToQualifyingBodyNotCharities	These are all of the assets being left to a qualifying body. These will not be charities that have a registered charity number.		Unchanged.
iht.timeout.signBackToGG	Sign back in to Government Gateway	Mewngofnodwch yn ôl i Borth y Llywodraeth	Unchanged.
iht.estateReport.exemptions.guidance.claimingEstateExemptions	Claiming estate exemptions		Unchanged.
page.iht.application.debts.overview.funeralExpenses.screenReader.value	The value of funeral expenses is £{0}		Unchanged.
global.error.badRequest400.title	Bad request - 400	Cais drwg – 400	Unchanged.
page.iht.application.exemptions.assetLeftToGncp.screenReader.value	Value of assets left to another qualifying body is £{0}		Unchanged.
page.iht.application.debts.debtsOutsideUk.description.p1	This is the value of all debts owed to anyone outside of the UK including anything owed on any foreign assets.		Unchanged.
page.iht.application.overview.assets.screenReader.noValue.link	Start giving details about assets in the estate		Unchanged.
error.currencyValue.length	Enter a value using less than 11 numbers	Nodwch werth gan ddefnyddio llai nag 11 rhif	Unchanged.
page.iht.registration.applicantDetails.postcode.help	If your address is in the UK	Os yw'ch cyfeiriad yn y DU	Unchanged.
page.iht.home.applicationList.table.guidance.p2.empty	If you have already completed a registration and the details are not listed above, call the Inheritance Tax helpline on 0300 123 1072 for help. Call +44 300 123 1072 if you are outside of the UK.		Unchanged.
page.iht.application.estateOverview.declaration.allSectionsNotComplete.guidance.text1	You have not given enough details to finish this estate report		Unchanged.
site.button.confirmDelete	Confirm and delete	Cadarnhau a dileu	Unchanged.
error.positive.number	This field must be greater than 0.	Rhaid i'r blwch hwn fod yn fwy na 0.	Unchanged.
page.iht.home.ihtReference.label	Reference		Unchanged.
page.iht.application.exemptions.overview.qualifyingBody.screenReader.link.moreDetail	Give more details for assets left to other qualifying bodies		Unchanged.
page.iht.application.debts.overview.other.screenReader.link.moreDetail	Give more detail about any other debts not listed		Unchanged.
page.iht.registration.executor-overview.entity-name	executor	ysgutor	Unchanged.
iht.registration.coExecutors.changeIfOthers	Change if other people are applying for probate	Newid os yw pobl eraill yn gwneud cais am Brofiant	Unchanged.
iht.nextSteps	Next steps	Camau nesaf	Unchanged.
page.iht.registration.registrationSummary.deceasedInfo.name.data.screenReader	Deceased’s name is {0}		Unchanged.
page.iht.application.exemptions.total	Total value of assets taken away from the estate value		Unchanged.
page.iht.registration.registrationSummary.coExecutorTable.none.link.screenReader	and add another {0}	ac ychwanegu {0} arall	Unchanged.
iht.iv.unableToContinue	This online service is unable to continue at the moment.	Nid yw'r gwasanaeth ar-lein yn medru parhau ar hyn o bryd.	Unchanged.
error.assets.insurancePolicy.isInTrust.select	Select an answer for whether the deceased ever paid for an insurance policies that was placed in trust in the 7 years before they died	Dewiswch ateb ar gyfer a dalodd yr ymadawedig am unrhyw bolisiau yswiriant a roddwyd mewn ymddiriedolaeth yn y 7 mlynedd cyn iddo/iddi farw.	Unchanged.
error.address.givePostcodeUsingNumbersAndLetters	Give a postcode using numbers and letters	Rhowch god post gan ddefnyddio rhifau a llythrennau	Unchanged.
page.iht.application.exemptions.overview.partner.assetsLeftForPartner.screenreader.link.value	Change the answer for did {0} leave anything to their spouse or civil partner		Unchanged.
error.assets.property.tenure.select	Select if this property, building or land was freehold or leasehold	Dewiswch a oedd yr eiddo, yr adeilad neu'r tir yn rhydd-ddaliadol neu'n brydlesol	Unchanged.
error.assets.property.type.select	Select what kind of property, building or land this is	Dewiswch pa fath o eiddo, adeilad neu dir ydoedd	Unchanged.
page.iht.registration.checklist.label1	You will need to have all of the details listed below before you start.		Unchanged.
error.partner.blank.summary	enter a value for total assets	nodwch werth ar gyfer cyfanswm yr asedion	Unchanged.
page.iht.application.exemptions.overview.qualifyingBody.screenReader.link.noValue	Give an answer for assets left to other qualifying bodies		Unchanged.
page.iht.application.overview.exemptions.screenReader	The value of estate exemptions being claimed is £{0}		Unchanged.
error.invalid.date.format	You must specify a valid date	Rhaid i chi nodi dyddiad dilys	Unchanged.
page.iht.application.overview.exemptions.screenReader.value.link	View or change estate exemptions		Unchanged.
page.iht.registration.applicant.applyingForProbate.browserTitle	Apply for probate	Gwneud cais am Brofiant	Unchanged.
page.iht.registration.registrationSummary.subTitle	You will not be able to change these details online after you have confirmed them.		Unchanged.
iht.shouldUseOnlineService	You must use the online service	Mae'n rhaid i chi ddefnyddio'r gwasanaeth ar-lein	Unchanged.
error.lastName.giveUsingXCharsOrLess	Give a last name using 40 characters or less	Rhowch enw olaf gan ddefnyddio 40 cymeriad neu lai	Unchanged.
page.iht.application.exemptions.charityOverview.questionLabel.screenreader.link.value	Change the answer for did {0} leave any assets to a charity		Unchanged.
site.noCharityNameAndNumberGiven	No charity name or number added		Unchanged.
page.iht.registration.applicantDetails.role.donee.hint	Someone who has received a gift from the deceased in the 7 years before they died.	Rhywun sydd wedi cael rhodd oddi wrth yr ymadawedig yn y 7 mlynedd cyn y bu farw.	Unchanged.
page.iht.iv.failure.2fa.p1	You will not be able to use Inheritance Tax Online until you have set up 2-step verification. This is because you need to securely sign in to protect your personal details.		Unchanged.
site.link.return.household	Return to household and personal items	Yn ôl i eitemau i'r tŷ ac eitemau personol	Unchanged.
iht.valueOfExemptions	Value of exemptions		Unchanged.
error.assets.property.ownership.select	Select how this property, building or land was owned	Dewiswch sut y perchenogwyd yr eiddo, yr adeilad neu'r tir	Unchanged.
error.applicant.selectIfAnyoneElseApplyingForProbate	Select if anyone else is applying for probate	Dewiswch os yw unrhyw un arall yn gwneud cais am Brofiant	Unchanged.
error.dateOfDeath.giveCorrectDayForMonth	Give the correct date of death using the correct number of days for that month	Rhowch y diwrnod cywir ar gyfer y farwolaeth gan ddefnyddio'r nifer cywir o ddyddiau ar gyfer y mis hwnnw	Unchanged.
page.iht.registration.registrationSummary.applicantInfo.address.link.screenReader	Change your address	Newid eich cyfeiriad	Unchanged.
error.address.wasInUK.give	Give an answer for if the address was in the UK	Rhowch ateb ar gyfer a oedd y cyfeiriad yn y DU	Unchanged.
page.iht.registration.others-applying-for-probate-address.sectionTitlePostfix	{0} address	Cyfeiriad {0}	Unchanged.
page.iht.application.overview.value	Estate value		Unchanged.
error.debtsFromTrust.currencyValue.summary	enter a value for debts owed from a trust using only numbers	nodwch werth ar gyfer dyledion sy'n ddyledus o ymddiriedolaeth gan ddefnyddio rhifau'n unig	Unchanged.
error.dateOfBirth.giveCorrectYear	Give a correct year of birth	Rhowch flwyddyn geni gywir	Unchanged.
page.iht.application.overview.total.screenReader.value	{0}’s estate value is £{1}.		Unchanged.
page.iht.application.exemptions.assetLeftToGncp.question1	Were any assets left to another qualifying body?		Unchanged.
page.iht.application.overview.threshold.screenReader.value.link	View or change details given to increase the threshold		Unchanged.
page.iht.application.overview.cleared.helptext1	You have confirmed that you have nothing left to do with this estate.		Unchanged.
page.iht.registration.registrationSummary.coExecutorTable.email.data.screenReader	{0}'s email address is {1}	{1} yw cyfeiriad e-bost {0}	Unchanged.
error.assets.vehicles.deceasedOwned.select	Select an answer for whether there are any motor vehicles in the estate	Dewiswch ateb ar gyfer a oes unrhyw gerbydau modur yn yr ystâd	Unchanged.
page.iht.registration.title	Registration	Cofrestru	Unchanged.
error.length.giftsDetails.exemptions	Enter a value using less than 11 numbers	Nodwch werth gan ddefnyddio llai nag 11 rhif	Unchanged.
page.iht.application.exemptions.deleteCharity.screenReader	The name of the charity you may delete is {0} and it is registered charity number is {1}		Unchanged.
page.iht.registration.applicantDetails.kickout.probate.summary	This is because you are not applying for probate in England or Wales.		Unchanged.
error.currencyValue.incorrect.summary	enter a value using only numbers	nodwch werth gan ddefnyddio rhifau'n unig	Unchanged.
error.otherAsset.currencyValue.length.summary	enter a value for other assets owned using less than 11 numbers	nodwch werth asedion eraill gan ddefnyddio llai nag 11 rhif	Unchanged.
page.iht.application.charity.add.registerednumber.helptext.contents1	You can find the registered charity number by searching		Unchanged.
page.iht.application.overview.timeScale.guidance	If you do not send the estate report by this date, it will be deleted and you will have to start again.		Unchanged.
error.dateOfMarriage.giveCorrectYear	Give a correct year of marriage	Rhowch flwyddyn gywir ar gyfer priodi	Unchanged.
page.iht.registration.applicantDetails.role.settlor.hint	Someone who has placed an asset into a trust.	Rhywun sydd wedi rhoi ased mewn ymddiriedolaeth.	Unchanged.
page.iht.application.overview.browserTitle	Estate overview		Unchanged.
iht.registration.checklist.dateOfBirth	date of birth	dyddiad geni	Unchanged.
error.charityNumber.give	Give the registered charity number	Rhowch rif cofrestru'r elusen	Unchanged.
page.iht.registration.applicant.probateLocation.browserTitle	Probate location	Lleoliad y profiant	Unchanged.
iht.start	Start	Dechrau	Unchanged.
page.iht.registration.applicantDetails.title.hint	enter Mr, Mrs, Miss, Ms or other title		Unchanged.
iht.registration.kickout.ifWantChangeDeceasedLocation	If you want to change the location of the person who has died’s permanent home		Unchanged.
error.assets.businessInterest.select	Select an answer for whether there are any business interests owned in the estate	Dewiswch ateb ar gyfer a oes unrhyw fuddiannau busnes eraill mewn perchenogaeth yn yr ystâd	Unchanged.
page.iht.registration.duplicateRegistration.ref.text	If any details have changed, phone the Inheritance Tax helpline on 0300 123 1072 to make any changes. Call +44 300 123 1072 if you are outside of the UK.		Unchanged.
page.iht.registration.deceasedDetails.maritalStatus.single.hint	The deceased was never married or in a civil partnership.	Ni fu'r ymadawedig yn briod na mewn partneriaeth sifil ar unrhyw adeg.	Unchanged.
page.iht.registration.applicantDetails.phoneNo.hint	This can be a mobile or a landline. HMRC might need to contact you by telephone to talk about any details you give.	Gall hwn fod yn ffôn symudol neu'n llinell dir. Mae'n bosibl y bydd angen i CThEM gysylltu â chi dros y ffôn i drafod unrhyw fanylion a rowch.	Unchanged.
page.iht.application.exemptions.title	estate exemptions		Unchanged.
error.assets.stocksAndShares.listed.select	Select an answer for whether there are any listed stocks and shares in the estate	Dewiswch ateb ar gyfer a oes unrhyw stoc a chyfranddaliadau wedi'u rhestru yn yr ystâd	Unchanged.
page.iht.application.exemptions.assetLeftToCharity.addCharity	Add a charity		Unchanged.
page.iht.registration.deceasedDetails.addressheader.uk.hint	This is the last address in the UK where {0} could have been contacted before they died.		Unchanged.
iht.yes	Yes	Iawn	Unchanged.
page.iht.application.exemptions.overview.partner.name.screenreader.link.value	Change the name of the spouse or civil partner		Unchanged.
site.button.declare	Accept and send	Derbyn ac anfon	Unchanged.
error.assets.heldInTrust.moreThanOne.select	Select an answer for whether the deceased benefitted from, had the right to benefit from, a trust during their lifetime	Dewiswch ateb ar gyfer a bu'r ymadawedig elwa o ymddiriedolaeth, neu a bu ganddo/ganddi'r hawl i elwa o ymddiriedolaeth, yn ystod ei fywyd/bywyd	Unchanged.
page.iht.registration.deceasedAddressQuestion.title	Was {0}’s last contact address in the UK?		Unchanged.
page.iht.registration.registrationSummary.deceasedInfo.name.link.screenReader	Change {0}’s name		Unchanged.
page.iht.application.exemptions.partner.dateOfBirth.browserTitle	Partner’s date of birth		Unchanged.
page.iht.application.debts.debtsOutsideUk.description.p2	You must change the foreign value to British pounds using the exchange rate on the date of death.		Unchanged.
site.link.edit	Edit	Golygu	Unchanged.
page.iht.registration.duplicateRegistration.ref.title	You can start this estate report on your Inheritance Tax reports page.	Gallwch ddechrau'r adroddiad ystâd ar eich tudalen adroddiadau ystâd o ran Treth Etifeddiant.	Unchanged.
error.isPartnerHomeInUK.select	Select an answer for if the deceased's spouse or civil partner has their permanent home in the UK	Dewiswch ateb ar gyfer os yw cartref parhaol priod neu bartner sifil yr ymadawedig yn y DU	Unchanged.
error.deceasedPermanentHome.selectLocation	Select the location of the deceased’s permanent home		Unchanged.
page.iht.application.debts.overview.other.screenReader.link.value	Change the value of any other debts not listed		Unchanged.
page.iht.application.debts.overview.debtsFromTrust.screenReader.noValue	You have not given a value for debts owed from a trust		Unchanged.
site.noDebts	No debts owed	Dim dyledion	Unchanged.
error.report.redo	Select the estate report through the Your Inheritance Tax estate reports page and send the details again.	Dewiswch yr adroddiad ystâd drwy'r tudalennau Eich adroddiadau ystâd o ran Treth Etifeddiant ac anfonwch y manylion eto.	Unchanged.
page.iht.application.debts.funeralExpenses.isOwned	Are there any funeral expenses being paid out of the estate?		Unchanged.
iht.dateofbirth	Date of birth	Dyddiad geni	Unchanged.
page.iht.application.debts.overview.debtsOutsideUk.screenReader.noValue	You have not given a value for debts owed to anyone outside of the UK		Unchanged.
error.assets.other.select	Select an answer for whether there are any other assets not listed in the estate	Dewiswch ateb ar gyfer os oes unrhyw asedion nas restrwyd yn yr ystâd	Unchanged.
page.iht.application.exemptions.charityValue.sectionTitle	Total value of all assets left to the charity		Unchanged.
iht.dropdown.closed	Suggestions list closed		Unchanged.
page.iht.registration.checklist.label2	There is no way to save your progress until you have given all of these details, so only start once you have everything you will need.		Unchanged.
page.iht.application.debts.overview.funeralExpenses.screenReader.noValue	You have not given a value for funeral expenses		Unchanged.
page.iht.application.exemptions.charityValue.browserTitle	Value of assets left to charity		Unchanged.
iht.postcode	Postcode	Cod post	Unchanged.
page.iht.application.overview.assets.screenReader	The value of assets in the estate is £{0}		Unchanged.
site.link.return.gifts	Return to gifts given away	Yn ôl i roddion a rhoddwyd i ffwrdd	Unchanged.
page.iht.application.overview.assets.screenReader.noValue	You have not entered any assets in the estate		Unchanged.
site.noAssets	No assets	Dim asedion	Unchanged.
page.iht.application.overview.threshold.screenReader.value	{0}’s inheritance tax threshold is £{1}		Unchanged.
page.iht.application.exemptions.partner.totalAssets.label	Total value of all assets left to spouse or civil partner		Unchanged.
pdf.exemption.spouse	Spouse or civil partner		Unchanged.
iht.countries.northernIreland	Northern Ireland	Gogledd Iwerddon	Unchanged.
page.iht.registration.applicant.probateLocation.title	Where are you going to apply for probate?	Ymhle'r ydych yn mynd i wneud cais am Brofiant?	Unchanged.
error.selectAnswer	Select an answer	Dewiswch ateb	Unchanged.
error.dateOfBirth.incorrect.summary	enter a valid date of birth	nodwch ddyddiad geni dilys	Unchanged.
page.iht.application.estateOverview.increaseThreshold.increased	Increased		Unchanged.
page.iht.application.debts.debtsTrust.description.p1	This is the value of any debts owed from a trust that {0} was benefitting from. If the trustees only gave you the value of a trust after deducting any debts then do not include a value here.		Unchanged.
page.iht.application.estateOverview.claimExemptions.link	I want to claim exemptions		Unchanged.
error.debtsOutsideUk.currencyValue.length.summary	enter a value for debts owed outside of the UK using less than 11 numbers	nodwch werth ar gyfer dyledion sy'n ddyledus y tu allan i'r DU gan ddefnyddio llai nag 11 rhif	Unchanged.
page.iht.registration.registrationSummary.coExecutorTable.others-are-applying.text	Other people are applying for probate	Mae pobl eraill yn gwneud cais am Brofiant	Unchanged.
page.iht.application.overview.exemptions.screenReader.noValue	You have not entered any estate exemptions		Unchanged.
error.dateOfMarriage.giveFull	Give a full date of marriage	Rhowch ddyddiad llawn ar gyfer priodi	Unchanged.
global.error.badRequest400.heading	Bad request	Cais drwg	Unchanged.
error.dateOfDeath.giveCorrectMonth	Give a correct month of death using numbers 1 to 12	Rhowch fis cywir ar gyfer y farwolaeth gan ddefnyddio'r rhifau 1 i 12	Unchanged.
page.iht.application.debts.overview.funeralExpenses.screenReader.link.value	Change the value of funeral expenses		Unchanged.
page.iht.registration.registrationSummary.applicantInfo.email.link.screenReader	Change your email address	Newid eich cyfeiriad e-bost	Unchanged.
page.iht.registration.deceasedDetails.maritalStatus.civilPartner.hint	The deceased divorced their spouse or dissolved their civil partnership and never remarried.	Roedd yr ymadawedig wedi ysgaru'i briod/phriod neu wedi diddymu'i bartneriaeth/phartneriaeth sifil, a heb ailbriodi ar unrhyw adeg.	Unchanged.
page.iht.application.debts.overview.other.screenReader.link.noValue	Give a value for any other debts not listed		Unchanged.
site.link.return.stocksAndShares	Return to stocks and shares	Yn ôl i stociau a chyfranddaliadau	Unchanged.
error.dateOfDeath.giveCorrectDayMonth	Give a correct day and month for date of death		Unchanged.
page.iht.iv.failure.preconditionFailed.p1	You have already registered with another account.		Unchanged.
page.iht.registration.registrationSummary.deceasedInfo.location.link.screenReader	Change the location of {0}’s permanent home		Unchanged.
error.dateOfMarriage.giveCorrectMonth	Give a correct month of marriage using numbers 1 to 12	Rhowch fis cywir ar gyfer priodi gan ddefnyddio'r rhifau 1 i 12	Unchanged.
iht.estateReport.exemptions.qualifyingBodies.assetsLeftToQualifyingBodies.title	Assets left to other qualifying bodies		Unchanged.
iht.startAgain	Start again	Dechrau eto	Unchanged.
iht.iv.exit	Exit	Gadael	Unchanged.
