error.estateReport.value.giveWithNoSpaces	Give the value without any spaces between numbers	Rhowch y gwerth heb unrhyw fylchau rhwng rhifau	English not updated. Welsh not updated.
page.iht.application.debts.overview.mortgages.screenReader.link.moreDetail	Give more details about mortgages		Added.
page.iht.application.debts.overview.mortgages.screenReader.link.noValue	Give a value for mortgages		Added.
page.iht.application.assets.deceased-permanent-home.table.header	Properties		Added.
iht.estateReport.debts.mortgages	Mortgages		Added.
page.iht.application.debts.mortgageValue.title	Did {0} have a mortgage on this property?		Added.
page.iht.application.debts.mortgages.noProperties.description	You have not added any properties, buildings or land as an asset.		Added.
page.iht.application.debts.jointlyOwned.browserTitle	Joint debts		Added.
page.iht.application.debts.mortgages.description.p1	You should use the outstanding balance remaining to pay off a mortgage as the value. Some providers might describe this differently so check with them if you are unsure of how much is outstanding on a mortgage.		Added.
page.iht.application.debts.jointlyOwned.description.p1	This is if {0} jointly owned any assets and there are debts owed on them. This does not include the mortgage on any jointly owned properties.		Added.
error.debts.mortgage.select	Select an answer for if there was a mortgage on this property, building or land	Dewiswch ateb ar gyfer os oedd morgais ar yr eiddo, adeilad neu dir	English not updated. Welsh not updated.
iht.estateReport.debts.owedOnJointAssets.value	Value of any debts owed on jointly owned assets		Added.
site.link.return.mortgage.overview	Add a mortgage value for a property, building or land		English updated. Welsh blanked.
page.iht.application.debts.mortgageValue.browserTitle	Any mortgage on property		Added.
page.iht.application.debts.jointlyOwned.description.p2	You should only include {0}’s share of any debts owed on jointly owned assets.		Added.
error.estateReport.value.giveWithCorrectComma	Give the correct value with no comma or with the comma in the right place	Rhowch y gwerth cywir heb goma neu gyda'r coma yn y man cywir	English not updated. Welsh not updated.
page.iht.application.debts.overview.mortgages.screenReader.link.value	Change the value of mortgages		Added.
page.iht.application.debts.overview.mortgages.screenReader.value	The value of mortgages is £{0}		Added.
page.iht.application.debts.mortgages.description	If {0} had a loan secured against a property they owned, include that value here.		Added.
page.iht.application.debts.mortgages.noProperties.warning.text	If you have not added a property, building or land as an asset, or the one that you want to add a mortgage against, then you will need to add it as an asset before you can give the mortgage value.		Added.
site.link.giveDetails	Give details	Rhowch fanylion	English not updated. Welsh not updated.
page.iht.application.debts.mortgage.inputText.value	Value of mortgage		Added.
error.estateReport.value.giveLessThanEleven	Give the value using 10 characters or less	Rhowch y gwerth gan ddefnyddio 10 cymeriad neu lai	English not updated. Welsh not updated.
error.estateReport.value.give	Give the value	Rhowch y gwerth	English not updated. Welsh not updated.
iht.estateReport.debts.mortgage.valueOfDeceasedsShare	Value of deceased’s share of mortgage		Added.
page.iht.application.debts.mortgages.description.p3	If {0} had a mortgage protection policy which paid out after they died, you should include that value as an asset under insurance policies owned.		Added.
iht.estateReport.debts.owedOnJointAssets	Debts owed on any jointly owned assets		Added.
iht.saveAndContinue	Save and continue	Cadw a mynd yn eich blaen	English not updated. Welsh not updated.
page.iht.application.debts.overview.mortgages.screenReader.noValue	You have not given a value for mortgages		Added.
error.estateReport.value.giveCorrectNumberOfPence	Give the value with the correct number of pence	Rhowch y gwerth gyda'r nifer cywir o geiniogau	English not updated. Welsh not updated.
page.iht.application.assets.property.address.property.change	Change details for property {0}		Added.
iht.change	Change	Newid	English not updated. Welsh not updated.
page.iht.application.debts.jointlyOwned.isOwned	Are there any debts being paid out of the estate that are owed on any jointly owned assets?		Added.
site.noMortgage	No mortgage	Dim morgais	English not updated. Welsh not updated.
site.link.return.debts	Return to debts owed from the estate	Yn ôl i ddyledion sydd ar yr ystâd	English not updated. Welsh not updated.
error.estateReport.value.giveValueUsingNumbers	Give the value only using numbers	Rhowch y gwerth gan ddefnyddio rhifau'n unig	English not updated. Welsh not updated.
page.iht.application.overview.common.viewcopy	View a copy of this estate report (PDF, <500KB)		Unchanged.
error.stockAndShare.currencyValue.length.summary	enter a value for stocks and shares using less than 11 numbers	nodwch werth ar gyfer stoc a chyfranddaliadau gan ddefnyddio llai nag 11 rhif	Unchanged.
site.phoneNo.hint	This can be a mobile or a landline. HMRC might need to contact them about any of the details you provide.	Gall hwn fod yn ffôn symudol neu'n llinell dir. Mae'n bosibl y bydd angen i CThEM cysylltu â nhw ynghylch y manylion yr ydych yn eu rhoi.	Unchanged.
page.iht.registration.applicantDetails.role.trustee.hint	Someone in charge of managing a trust for the deceased.	Rhywun sy'n gyfrifol am reoli ymddiriedolaeth ar gyfer yr ymadawedig.	Unchanged.
page.iht.application.exemptions.partner.dateOfBirth.question.title	What is the spouse’s or civil partner’s date of birth?		Unchanged.
site.link.add.property	Add a property, building or land owned by the deceased	Ychwanegu eiddo, adeilad neu dir yr oedd yr ymadawedig yn berchen arno	Unchanged.
site.button.save.return.mortgages	Save and return to mortgages	Cadw ac yn ôl i forgeisi	Unchanged.
error.assets.money.deceasedOwned.select	Select an answer for whether there is any money owned only be the deceased	Dewiswch ateb ar gyfer a oes unrhyw arian yn ddyledus gan yr ymadawedig yn unig	Unchanged.
page.iht.application.overview.common.viewcertificate	View clearance certificate (PDF, <500KB)		Unchanged.
page.iht.application.exemptions.assetLeftToCharity.screenreader.ident	Charity {0}.		Unchanged.
page.iht.application.exemptions.charityName.sectionTitle	What is the charity’s name?		Unchanged.
page.iht.application.exemptions.charityOverviewTable.header	Charities		Unchanged.
page.iht.registration.registrationSummary.coExecutorTable.dateOfBirth.data.screenReader	{0}’s date of birth is {1}		Unchanged.
error.postcode.incorrect	Enter a valid postcode	Nodwch god post dilys	Unchanged.
error.giftsDetails.exceedsGivenAway	The total value of exemptions being claimed on a year cannot be more than the total value of gifts given away	Ni all cyfanswm yr eithriadau sy'n cael eu hawlio ar gyfer flwyddyn fod yn fwy na chyfanswm gwerth y rhoddion a rhoddwyd i ffwrdd	Unchanged.
page.iht.registration.registrationSummary.applicantInfo.dateOfBirth.data.screenReader	Your date of birth is {0}. This cannot be changed		Unchanged.
global.error.InternalServerError500.message	Please try again in a few moments.	Rhowch gynnig arall arni mewn ychydig.	Unchanged.
page.iht.application.exemptions.partner.name.browserTitle	Partner’s name		Unchanged.
error.length.assets.policies	Enter a value using less than 11 numbers	Nodwch werth gan ddefnyddio llai nag 11 rhif	Unchanged.
page.iht.iv.failure.userAborted.p1	You can try again when you have the information you need or, if you have a query,		Unchanged.
page.iht.application.exemptions.guidance.content2.linkText	you can return to the estate overview page		Unchanged.
iht.continue	Continue	Parhau	Unchanged.
site.previous	Previous	Blaenorol	Unchanged.
page.iht.registration.completedRegistration.p2	You will be able to:	Byddwch yn gallu gwneud y canlynol:	Unchanged.
page.iht.application.exemptions.qualifyingBodyOverview.browserTitle	Assets left to other bodies		Unchanged.
page.iht.registration.completedRegistration.p2.bullet3	find out what the value of the estate is when you have given all of the details about what was owned and owed – this will tell you if there is any Inheritance Tax to pay		Unchanged.
site.fullName	Full name	Enw llawn	Unchanged.
iht.notPossibleToUseService	It is not possible for you to use this service		Unchanged.
iht.registration.deceasedDetails.title	About the person who has died		Unchanged.
page.iht.registration.applicantTellUsAboutYourself.question.label	Do you live in the UK?	A ydych yn byw yn y DU?	Unchanged.
page.iht.registration.multipleExecutors.warning.p2	By confirming this change, you will also be changing the role to {0} of anyone else who is applying for probate.		Unchanged.
error.assets.insurancePolicy.deceasedOwned.select	Select an answer for whether there are any insurance policies owned by the deceased in the estate	Dewiswch ateb ar gyfer a oes unrhyw bolisïau yswiriant yr oedd yr ymadawedig yn berchen arnynt yn yr ystâd	Unchanged.
error.businessInterest.currencyValue.length.summary	enter a value for businesses owned using less than 11 numbers	nodwch werth ar gyfer busnesau mewn perchenogaeth gan ddefnyddio llai nag 11 rhif	Unchanged.
page.iht.registration.registrationSummary.coExecutorTable.name.data.screenReader	An additional{0}’s name is {1}		Unchanged.
error.lastName.give	Give a last name	Rhowch enw olaf	Unchanged.
page.iht.application.charity.add.registerednumber.helptext	How to find out the charity number		Unchanged.
page.iht.application.exemptions.assetLeftToCharity.browserTitle	Any assets left to a charity		Unchanged.
page.iht.registration.deceasedDateOfDeath.kickout.date.capital.tax.summary	This is because the deceased died before 18 March 1986. Capital Transfer Tax or Estate Duty were used for deaths before this date.	Mae hyn oherwydd bod yr ymadawedig wedi marw cyn 18 Mawrth 1986. Defnyddiwyd Treth Trosglwyddo Cyfalaf neu Dreth Ystâd ar gyfer marwolaethau cyn y dyddiad hwn.	Unchanged.
page.iht.application.overview.closed.helptext	When you have completed everything to do with this estate, including receiving your grant of representation from the Probate Service, you can complete clearance of this estate report.		Unchanged.
site.changeName	Change name	Newid enw	Unchanged.
iht.dropdown.of	({0} of {1})		Unchanged.
page.iht.application.exemptions.guidance.link	Continue to estate exemptions		Unchanged.
error.moneyOwed.currencyValue.length.summary	enter a value for money owed using less than 11 numbers	nodwch werth ar gyfer arian sy'n ddyledus gan ddefnyddio llai nag 11 rhif	Unchanged.
iht.estateReport.debts.valueOfFuneralCosts	Value of the funeral expenses		Unchanged.
error.lastName.blank.summary	enter a last name	nodwch enw olaf	Unchanged.
page.iht.application.overview.debts.screenReader.noValue	You have not entered any debts owed from the estate		Unchanged.
page.iht.registration.registrationSummary.deceasedInfo.address.link.screenReader	Change {0}’s address		Unchanged.
iht.name.lowerCaseInitial	name	enw	Unchanged.
iht.dateOfDeath	Date of death	Dyddiad y farwolaeth	Unchanged.
page.iht.application.exemptions.assetLeftToPartner.description	These are all of the assets that are being left to the deceased’s spouse or civil partner.		Unchanged.
iht.estateReport.returnToEstateOverview	Return to estate overview		Unchanged.
page.iht.application.exemptions.overview.charity.detailsOverview.name.screenreader.link.value	Change the charity name		Unchanged.
page.iht.registration.multipleExecutors.continueWhen.confirm	Confirm the change to {0}.	Cadarnhau'r newid i {0}.	Unchanged.
page.iht.home.currentStatus	Status		Unchanged.
iht.estateReport.exemptions.guidance.debtsSubtracted	If you claim any exemptions, any debts that are owed from the estate will also be taken off the estate value.		Unchanged.
error.isGiftMadeBeforeDeath.select	Select an answer for if the deceased's spouse or civil partner gave any gifts away that were not exempt in the 7 years before they died	Dewiswch ateb ar gyfer os roddodd priod neu bartner sifil yr ymadawedig unrhyw roddion i ffwrdd nad oeddent wedi'u heithrio yn ystod y 7 mlynedd cyn y farwolaeth	Unchanged.
error.problem	There is a problem		Unchanged.
page.iht.registration.deceasedDetails.maritalStatus.widowed.hint	The deceased’s spouse or civil partner died before them and they never remarried.		Unchanged.
page.iht.application.estateOverview.noValue	No value given		Unchanged.
error.foreign.currencyValue.summary	enter a value for foreign assets using only numbers	nodwch werth ar gyfer asedion o dramor gan ddefnyddio rhifau'n unig	Unchanged.
error.giftSevenYearsGivenInLast7Years.select	Select an answer for if the deceased gave away any of the type of gifts listed in the 7 years before death	Dewiswch ateb ar gyfer os rhoddodd yr ymadawedig unrhyw fath o rodd a restrwyd i ffwrdd yn y 7 blynedd cyn marwolaeth	Unchanged.
page.iht.registration.checklist.deceased.label6	country where they had their permanent home – you can only use this service if the person who has died lived in England or Wales		Unchanged.
page.iht.registration.deceasedDetails.maritalStatus.label	What was the relationship status of the person who has died on the date of their death?		Unchanged.
page.iht.application.overview.exemptions.screenReader.moreDetails.link	Give more details about estate exemptions		Unchanged.
page.iht.registration.applicant.applyingForProbate	Are you applying for probate for {0}’s estate?		Unchanged.
iht.inheritanceTaxEstateReport	Inheritance Tax estate report		Unchanged.
page.iht.application.exemptions.overview.qualifyingBody.screenReader.noValue	You have not given a value for assets left to other qualifying bodies		Unchanged.
page.iht.application.exemptions.overview.qualifyingBody.detailsOverview.value.title	Total value of assets received by the qualifying body		Unchanged.
iht.registration.kickout.message.phone2	You will be sent the correct form to use to complete the estate report.		Unchanged.
page.iht.registration.applicantDetails.role.administrator.hint	Someone in charge of handling the deceased's affairs when there isn't a will.	Rhywun sy'n gyfrifol am ddelio â materion yr ymadawedig pan nad oes ewyllys.	Unchanged.
page.iht.application.debts.overview.debtsFromTrust.screenReader.link.moreDetail	Give more details about debts owed from a trust		Unchanged.
iht.estateReport.ihtThreshold	Inheritance Tax threshold		Unchanged.
page.iht.application.exemptions.partner.question1	Were any assets left to the deceased’s spouse or civil partner?		Unchanged.
page.iht.registration.registrationSummary.applicantInfo.nino.data.screenReader	Your national insurance number is {0}. This cannot be changed		Unchanged.
page.iht.registration.executor-overview.executor.change.screenReader	Change {0}’s details		Unchanged.
error.currencyValue.incorrect	Enter a value using only numbers	Nodwch werth gan ddefnyddio rhifau'n unig	Unchanged.
page.iht.home.browserTitle	Your estate reports		Unchanged.
page.iht.application.exemptions.qualifyingBodyOverview.noQualifyingBodies.text	You have not added any qualifying bodies to this estate.		Unchanged.
iht.estateReport.debts.owedOutsideUK	Debts owed to anyone outside of the UK		Unchanged.
page.iht.application.exemptions.overview.qualifyingBody.screenReader.value	The value of assets left to other qualifying bodies is £{0}		Unchanged.
iht.finishAndDeleteThisEstateReport	Finish and delete this estate report	Gorffen a dileu'r adroddiad ystâd hwn	Unchanged.
site.backToLastQuestion.values.link	Return to gift values	Yn ôl i werthoedd rhodd	Unchanged.
iht.registration.checklist.phoneNo.upperCaseInitial	Phone number	Rhif ffôn	Unchanged.
page.iht.application.exemptions.charityNumber.browserTitle	Charity number		Unchanged.
page.iht.application.probateDetails.content2.bullet3	the net estate figure is £{0}		Unchanged.
iht.estateReport.assets.qualifyingBodyAddAnother	Add another qualifying body		Unchanged.
page.iht.application.exemptions.overview.partner.screenReader.link.noValue	Give an answer for assets left to a spouse or civil partner		Unchanged.
iht.estateReport.exemptions.charities.noNameAdded	No name added		Unchanged.
page.iht.application.exemptions.overview.partner.dob.screenreader.link.value	Change the date of birth of the spouse or civil partner		Unchanged.
page.iht.registration.timeout.p2	You will need to sign back in to Government Gateway and start to register to use Inheritance Tax Online again.		Unchanged.
error.country.select	Enter a country		Unchanged.
page.iht.registration.applicantDetails.title	Tell us about yourself	Rhowch wybod i ni amdanoch	Unchanged.
page.iht.iv.failure.2fa.verifyLink	Verify your identity		Unchanged.
page.iht.registration.registrationSummary.applicantInfo.role.data.screenReader	Your role is an {0}	{0} yw'ch swyddogaeth	Unchanged.
iht.estateReport.changeValues	Change values		Unchanged.
error.isPartnerBenFromTrust.select	Select an answer for if the spouse or civil partner had the right to benefit from a trust in their lifetime	Dewiswch ateb ar gyfer os bu gan y priod neu'r partner sifil yr hawl i elwa o ymddiriedolaeth yn ystod ei fywyd/bywyd	Unchanged.
page.iht.registration.registrationSummary.coExecutorTable.name.link.screenReader	Change {0}’s Name		Unchanged.
page.iht.registration.registrationSummary.button	Confirm details	Cadarnhau manylion	Unchanged.
page.iht.application.exemptions.overview.partner.dob.screenreader.link.noValue	Give the date of birth of the spouse or civil partner		Unchanged.
page.iht.application.overview.assets.screenReader.moreDetails.link	Give more details about assets in the estate		Unchanged.
iht.closed	Closed		Unchanged.
page.iht.application.exemptions.guidance.increasing.threshold.p1	You could bring the estate value below the threshold by claiming any estate exemptions.		Unchanged.
page.iht.registration.applicantDetails.role.agent.hint	Someone who has been hired to act on behalf of an executor or an administrator.	Rhywun a huriwyd i weithredu ar ran ysgutor neu weinyddwr.	Unchanged.
site.link.giveName	Give name	Rhowch enw	Unchanged.
iht.firstName.hint	You do not have to give any middle names		Unchanged.
error.assets.money.jointlyOwned.select	Select an answer for whether there is any jointly owned money in the estate	Dewiswch ateb ar gyfer a oes unrhyw arian mewn perchenogaeth ar y cyd yn yr ystâd	Unchanged.
iht.inComplete.screenreader	{0} is incomplete	Mae {0} heb ei gyflawni	Unchanged.
page.iht.application.estateOverview.declaration.continue.guidance.text	The estate value is over the threshold. Continue when you have given all of the estate details that you know about.		Unchanged.
error.address.blank.summary	enter an address	nodwch gyfeiriad	Unchanged.
error.blank.assets.properties.tenure.summary	select is this property was freehold or leasehold	dewiswch a oedd yr eiddo yn rhydd-ddaliadol neu'n brydlesol	Unchanged.
page.iht.sign-out.p1	You have signed out from Inheritance Tax Online.		Unchanged.
pdf.exemption.table.text	Exemption		Unchanged.
page.iht.registration.applicantDetails.role.executor.hint	Someone named in a will as being in charge of handling the deceased's affairs.	Rhywun a enwir mewn ewyllys fel bod yn gyfrifol am ddelio â materion yr ymadawedig.	Unchanged.
page.iht.iv.failure.2fa.title	You cannot sign in to use Inheritance Tax Online		Unchanged.
page.iht.registration.deceasedDateOfDeath.kickout.date.other.summary	This is because the deceased died between 18 March 1986 and 5 April 2011.	Mae hyn oherwydd y bu'r ymadawedig farw rhwng 18 Mawrth 1986 a 5 Ebrill 2011.	Unchanged.
iht.signedOut	You’ve been signed out	Mae'r system wedi'ch allgofnodi	Unchanged.
page.iht.registration.applicantDetails.kickout.role.summary	This is because you are not an executor or an administrator for the deceased’s estate.		Unchanged.
page.iht.application.exemptions.deceasedName.title	{0}’s estate exemptions		Unchanged.
error.postcode.blank.summary	enter a postcode	nodwch god post	Unchanged.
iht.registration.kickout.content	You should complete the Inheritance Tax estate report using either an IHT-205 or IHT-400 paper form.		Unchanged.
page.iht.application.overview.debts.screenReader.moreDetails.link	Give more details about debts owed from the estate		Unchanged.
page.iht.application.overview.reducingTheEstateValue.total	Total taken away from the estate value		Unchanged.
page.iht.home.button.viewApplication.screenReader	View {0}’s estate report		Unchanged.
iht.registration.kickout.probateLocation.scotland	You should complete the Inheritance Tax estate report using either a C1 or a C5 paper form.		Unchanged.
iht.whatDoYouWantToDo	What do you want to do?	Beth yr ydych am ei wneud?	Unchanged.
error.dateOfDeath.giveCorrectMonthYear	Give a correct month and year for date of death		Unchanged.
page.iht.application.charity.add.registerednumber.helptext.contents2	Enter the charity’s name and you will be provided with its registered number.		Unchanged.
site.title.govuk	- GOV.UK		Unchanged.
iht.valueOfAssets	Value of assets		Unchanged.
page.iht.application.exemptions.overview.charity.detailsOverview.name.screenreader.link.noValue	Give the charity name		Unchanged.
page.iht.application.exemptions.assetLeftToGncp.screenReader.link.value	Change this value for assets left to another qualifying body		Unchanged.
iht.fullStop	.		Unchanged.
page.iht.registration.applicantDetails.postcode.label	Your postcode if the address is in the UK	Eich cod post os yw'r cyfeiriad yn y DU	Unchanged.
error.lastName.blank	Enter a last name	Nodwch enw olaf	Unchanged.
page.iht.application.debts.debtsOutsideUk.isOwned	Are there any debts being paid out of the estate that are owed to anyone outside of the UK?		Unchanged.
site.link.go.to.estateOverview	Go to estate overview	Ewch i drosolwg o'r ystâd	Unchanged.
page.iht.registration.checklist.title	Before you start registration	Cyn i chi ddechrau'r broses gofrestru	Unchanged.
page.iht.application.estateOverview.otherDetailsNeeded	Other details needed		Unchanged.
error.address.giveUsing35CharsOrLess	Give an address using 35 characters or less	Rhowch gyfeiriad gan ddefnyddio 35 cymeriad neu lai	Unchanged.
page.iht.application.exemptions.charityDelete.browserTitle	Delete charity		Unchanged.
iht.address.upperCaseInitial	Address	Cyfeiriad	Unchanged.
page.iht.application.overview.submit.button.disabled	To continue you need to tick that you have checked all of the estate details that you have entered and there is nothing else to tell HMRC about.		Unchanged.
page.iht.application.estateOverview.totalValueOfTheEstate	Total value of the estate		Unchanged.
page.iht.registration.others-applying-for-probate-address.address.guidance	This is where HMRC can contact them.	Dyma lle gall CThEM gysylltu â'r person hwnnw	Unchanged.
page.iht.registration.deceasedDetails.maritalStatus.widowed.label	Widowed or a surviving civil partner	Yn weddw neu'n bartner sifil sy'n goroesi	Unchanged.
iht.value	Value		Unchanged.
iht.estateReport.exemptions.qualifyingBodies.howFindOutQualifies	How to find out if another body qualifies		Unchanged.
error.checkCorrect	Check the details are correct, in the right place and in the right format.	Gwiriwch fod y manylion yn gywir, yn y man cywir ac yn y fformat cywir.	Unchanged.
page.iht.registration.registrationSummary.coExecutorTable.email.link.screenReader	Change {0}'s email address	Newid cyfeiriad e-bost {0}	Unchanged.
page.iht.application.overview.assets.screenReader.value.link	View or change assets in the estate		Unchanged.
iht.estateReport.debts.other.title	Any other debts not listed		Unchanged.
error.businessInterest.currencyValue.summary	enter a value for businesses owned using only numbers	nodwch werth ar gyfer busnesau mewn perchenogaeth gan ddefnyddio rhifau'n unig	Unchanged.
page.iht.home.button.continueApplication.screenReader	Continue {0}’s estate report		Unchanged.
iht.estateReport.debts.owedFromEstate	Debts owed from the estate		Unchanged.
page.iht.registration.deceasedDateOfDeath.dateOfDeath.hint	For example, 21 3 2010		Unchanged.
iht.estateReport.exemptions.charities.assetsLeftToCharities.title	Assets left to charities		Unchanged.
page.iht.registration.registrationSummary.applicantInfo.nino.link.screenReader	number	rhif	Unchanged.
page.iht.application.overview.threshold.screenReader.moreDetails.link	Give more details to increase the threshold		Unchanged.
iht.name.upperCaseInitial	Name	Enw	Unchanged.
iht.address.line2	Address line 2	Cyfeiriad – llinell 2	Unchanged.
iht.estateReport.debts.funeralExpenses.title	Funeral expenses		Unchanged.
page.iht.application.exemptions.overview.qualifyingBody.screenReader.link.value	Change the value for assets left to other qualifying bodies		Unchanged.
page.iht.registration.executor-overview.yesnoQuestion	Do you want to add another person who is applying for probate?	A ydych am ychwanegu person arall sy'n gwneud cais am Brofiant?	Unchanged.
page.iht.application.exemptions.charityNumber.p1	You can find the registered charity number by		Unchanged.
error.phoneNumber.giveUsing27CharactersOrLess	Give a phone number using 27 characters or less	Rhowch rif ffôn gan ddefnyddio 27 cymeriad neu lai	Unchanged.
error.assets.stocksAndShares.notListed.select	Select an answer for whether there are any unlisted stocks and shares in the estate	Dewiswch ateb ar gyfer a oes unrhyw stoc a chyfranddaliadau heb eu rhestru yn yr ystâd	Unchanged.
error.assets.foreign.select	Select an answer for whether there are any foreign assets in the estate	Dewiswch ateb ar gyfer os oes unrhyw asedion o dramor yn yr ystâd	Unchanged.
page.iht.application.exemptions.guidance.content2	If you do not want to claim any estate exemptions,		Unchanged.
error.assets.insurancePolicy.jointlyOwned.select	Select an answer for whether there are any jointly held insurance policies in the estate	Dewiswch ateb ar gyfer a oes unrhyw bolisïau yswiriant a ddelir ar y cyd yn yr ystâd	Unchanged.
