page.iht.sign-out.p2	Use the link in your Inheritance Tax email that you were sent if you want to sign back in.		Unchanged.
page.iht.registration.checklist.applicant.title	You will need your:		Unchanged.
error.dateOfBirth.giveCorrectMonth	Give a correct month of birth using numbers 1 to 12	Rhowch fis geni cywir gan ddefnyddio'r rhifau 1 i 12	Unchanged.
page.iht.iv.failure.technicalIssue.title	There is a technical problem		Unchanged.
page.iht.application.overview.inreview.sidebartitle	You have sent this report to HMRC.		Unchanged.
error.dateOfBirth.giveCorrectDay	Give a correct day of birth using numbers 1 to 31	Rhowch ddiwrnod geni cywir gan ddefnyddio'r rhifau 1 i 31	Unchanged.
error.privatePension.currencyValue.summary	enter a value for pensions using only numbers	nodwch werth ar gyfer pensiynau gan ddefnyddio rhifau'n unig	Unchanged.
page.iht.application.exemptions.partner.name.firstName.label	First name of spouse or civil partner		Unchanged.
page.iht.registration.multipleExecutors.guidance	A total of 4 {0}s can apply to the Probate Service for a grant of representation. You can add up to 3 other {0}s who are applying to the Probate Service with you.	Gall cyfanswm o 4 {0} wneud cais i'r Gwasanaeth Profiant am grant cynrychiolaeth. Gallwch ychwanegu hyd at 3 {0} arall sy'n gwneud cais i'r Gwasanaeth Profiant gyda chi.	Unchanged.
error.giftWithReservationFromBenefit.select	Select an answer for if there were any gifts with the reservation of benefit given away	Dewiswch ateb ar gyfer os oedd unrhyw roddion â budd amodol a rhoddwyd i ffwrdd	Unchanged.
error.isAssetForQualifyingBody.select	Select an answer for if any assets have been left to another qualifying body	Dewiswch ateb ar gyfer os oes unrhyw asedion wedi'u gadael i gorff cymwys arall	Unchanged.
iht.registration.changeAddressToAbroad	Change the address to one that is abroad		Unchanged.
site.button.finish	Finish	Gorffen	Unchanged.
iht.address.line1	Address line 1	Cyfeiriad – llinell 1	Unchanged.
page.iht.registration.registrationSummary.deceasedInfo.maritalStatus.label	Relationship status	Statws perthynas	Unchanged.
site.link.return.trusts	Return to assets held in trust	Yn ôl i asedion a ddelir mewn ymddiriedolaeth	Unchanged.
error.money.currencyValue.length.summary	enter a value for money owned using less than 11 numbers	nodwch werth ar gyfer arian mewn perchenogaeth gan ddefnyddio llai nag 11 rhif	Unchanged.
page.iht.application.exemptions.guidance.content1	You only need to claim estate exemptions if the estate value is over the Inheritance Tax threshold. If you do not know the estate value, it is recommended to only complete the assets, gifts and debts sections before you claim any exemptions.		Unchanged.
iht.iv.tryAgain	Try again	Rhowch gynnig arall arni	Unchanged.
page.iht.registration.checklist.deceased.label7	relationship status	statws perthynas	Unchanged.
site.link.return.exemptions	Return to estate exemptions	Yn ôl i eithriadau ystâd	Unchanged.
page.iht.iv.failure.userAborted.title	You do not have enough information to continue		Unchanged.
iht.noChangeToHowReportToHMRC	There is no change to how you report to HMRC		Unchanged.
page.iht.registration.registrationSummary.deceasedTable.title	Deceased’s details		Unchanged.
error.blank.assets.properties.typeOfOwnership	Select how this property was owned	Dewiswch sut y perchenogwyd yr eiddo	Unchanged.
page.iht.registration.registrationSummary.deceasedInfo.nino.data.screenReader	Deceased’s national insurance number is {0}		Unchanged.
page.iht.application.exemptions.overview.charity.detailsOverview.value.screenreader.link.noValue	Give the total value of assets the charity received		Unchanged.
page.iht.iv.failure.2fa.exitLink	Exit to Inheritance Tax on GOV.UK		Unchanged.
page.iht.registration.registrationSummary.coExecutorTable.address.data.screenReader	{0}’s address is {1}		Unchanged.
site.headers.overview.values	Information Provided	Gwybodaeth wedi'i rhoi	Unchanged.
page.iht.registration.applicantDetails.role.trustee.label	Trustee	Ymddiriedolwr	Unchanged.
page.iht.registration.registrationSummary.deceasedInfo.dateOfDeath.data.screenReader	Deceased’s date of death is {0}		Unchanged.
error.stockAndShare.currencyValue.summary	enter a value for stocks and shares using only numbers	nodwch werth ar gyfer stoc a chyfranddaliadau gan ddefnyddio rhifau'n unig	Unchanged.
page.iht.registration.deceasedDateOfDeath.title	What was the date of death?		Unchanged.
iht.nationalInsuranceNo	National Insurance number	Rhif Yswiriant Gwladol	Unchanged.
page.iht.registration.checklist.leaveLink	Leave this page to get all of the details you need	Gadael y dudalen hon i gael gafael ar yr holl fanylion sydd eu hangen arnoch	Unchanged.
page.iht.application.exemptions.overview.charity.screenReader.noValue	You have not given a value for assets left to charities		Unchanged.
page.iht.application.overview.closed.sidebartitle	This estate report has not been cleared.		Unchanged.
page.iht.application.exemptions.guidance.content3	Some assets might be exempt from Inheritance Tax if they are being passed to a spouse or civil partner, a charity or to another qualifying body.		Unchanged.
page.iht.registration.registrationSummary.applicantInfo.dateOfBirth.link.screenReader	date	dyddiad	Unchanged.
page.iht.application.debts.other.description.p2	This includes any loans {0} was paying, including those they were guaranteeing and had been asked to pay when they died.		Unchanged.
page.iht.application.exemptions.overview.screenReader.total	The total value of estate exemptions which are taken away from the estate value is £{0}		Unchanged.
page.iht.registration.multipleExecutors.warning.p1.executor	This means that you have been named in the deceased’s will as an executor of their estate.		Unchanged.
page.iht.registration.checklist.exec.reveal.label2	Their name should be given as it is shown on their passport or birth certificate. This might be different to the name that you know them by.	Dylid rhoi ei enw fel y mae'n ymddangos ar ei basbort neu dystysgrif geni. Gallai hwnnw fod yn enw gwahanol i'r un yr ydych yn ei adnabod.	Unchanged.
page.iht.application.debts.overview.debtsFromTrust.screenReader.link.noValue	Give a value for debts owed from a trust		Unchanged.
error.widowed.select	Select an answer for if the deceased was married at any point in their life and their spouse of civil partner died	Dewiswch ateb ar gyfer os oedd yr ymadawedig wedi priodi ar unrhyw adeg a bod ei briod/phriod neu'i bartner/phartner sifil wedi marw	Unchanged.
page.iht.application.debts.subtitle1	A debt is anything that {0} was responsible for paying. Only include debts that are being paid out of {1}’s estate.		Unchanged.
page.iht.registration.registrationSummary.applicantInfo.country.id	country	gwlad	Unchanged.
page.iht.application.exemptions.qualifyingBody.name.sectionTitle	What is the qualifying body’s name?		Unchanged.
site.link.giveNumber	Give number	Rhowch rif	Unchanged.
page.iht.registration.applicant.applyingForProbate.p2	You will be named as an executor of the estate if {0} left a will. If there was not a will, you would have been named as the administrator of the estate by a court.		Unchanged.
page.iht.application.exemptions.assetLeftToCharity.p1	These are all of the assets being left to a charity. The charity must have a registered charity number if they are based in the UK.		Unchanged.
page.iht.application.exemptions.overview.partner.name.screenreader.link.noValue	Give the name of the spouse or civil partner		Unchanged.
page.iht.application.exemptions.overview.partner.homeInUK.screenreader.link.noValue	Give answer for is the spouse’s or civil partner’s permanent home in the UK		Unchanged.
page.iht.registration.applicantDetails.title.label	Your title (optional)	Eich teitl (opsiynol)	Unchanged.
error.foreign.currencyValue.length.summary	enter a value for foreign assets using less than 11 numbers	nodwch werth ar gyfer asedion o dramor gan ddefnyddio llai nag 11 rhif	Unchanged.
error.household.currencyValue.summary	enter a value for household and personal items using only numbers	nodwch werth ar gyfer nwyddau'r tŷ a nwyddau personol gan ddefnyddio rhifau'n unig	Unchanged.
site.link.giveValues	Give values	Rhowch werthoedd	Unchanged.
page.iht.iv.failure.failedMatching.p1	If you cannot confirm your identity and you have a query,		Unchanged.
page.iht.application.overview.gifts.screenReader.moreDetails.link	Give more details about gifts given away		Unchanged.
iht.no	No	Na	Unchanged.
site.noneInEstate	None in estate	Dim mewn ystâd	Unchanged.
error.predeceasedDateOfDeath.afterMarriage	Enter a date of death which is after the date of marriage or civil partnership	Nodwch ddyddiad marwolaeth sydd ar ôl dyddiad priodas neu bartneriaeth sifil	Unchanged.
iht.notStarted	Not started	Heb ddechrau	Unchanged.
error.otherDebt.currencyValue.summary	enter a value for other debts using only numbers	nodwch werth ar gyfer dyledion eraill gan ddefnyddio rhifau'n unig	Unchanged.
iht.estateReport.exemptions.charities.totalValueOfAssetsCharityReceived	Total value of assets the charity received		Unchanged.
error.firstName.give	Give a first name	Rhowch enw cyntaf	Unchanged.
page.iht.registration.registrationSummary.deceasedInfo.location.id	domicile	domisil	Unchanged.
error.assets.vehicles.jointlyOwned.select	Select an answer for whether there are any jointly owned motor vehicles in the estate	Dewiswch ateb ar gyfer a oes unrhyw gerbydau modur mewn perchenogaeth ar y cyd yn yr ystâd	Unchanged.
page.iht.application.exemptions.overview.partner.nino.screenreader.link.value	Change the National Insurance number for the spouse or civil partner		Unchanged.
site.kickout.title	You are not able to use this service	Nid ydych yn medru defnyddio'r gwasanaeth hwn	Unchanged.
error.jointlyOwned.currencyValue.summary	enter a value for debts owed on joint assets using only numbers	nodwch werth ar gyfer dyledion sy'n ddyledus ar asedion ar y cyd gan ddefnyddio rhifau'n unig	Unchanged.
iht.registration.changeAddressToUK	Change to a UK address	Newid i gyfeiriad yn y DU	Unchanged.
page.iht.application.overview.closed.clearance	Complete clearance of this estate report		Unchanged.
page.iht.registration.others-applying-for-probate.browserTitle	Other probate applicants	Rhai eraill sy'n gwneud cais am Brofiant	Unchanged.
error.predeceasedDateOfMarriage.beforeDateOfDeath	Enter a date of marriage or civil partnership which is before the date of death	Nodwch ddyddiad priodas neu bartneriaeth sifil sydd cyn dyddiad y farwolaeth	Unchanged.
page.iht.registration.checklist.deceased.label3	date of death	dyddiad y farwolaeth	Unchanged.
site.nino.hint	For example, VO 12 34 56 D	Er enghraifft, VO 12 34 56 D	Unchanged.
page.iht.registration.registrationSummary.deceasedInfo.location.data.screenReader	The location of the deceased’s permanent home is {0}		Unchanged.
page.iht.registration.registrationSummary.applicantInfo.country.data.screenReader	You are applying for probate in {0}		Unchanged.
iht.dateExample	For example, 31 3 1980	Er enghraifft, 31 3 1980	Unchanged.
iht.estateReport.exemptions.qualifyingBodies.returnToAssetsLeftToQualifyingBodies	Return to assets left to other qualifying bodies		Unchanged.
error.giftSevenYearsToTrust.select	Select an answer for if the deceased gifted a property, building or land to a non-person	Dewiswch ateb ar gyfer os rhoddodd yr ymadawedig eiddo, adeilad neu dir i endid nad yw'n berson	Unchanged.
error.assets.insurancePolicy.payedToSomeoneElse.select	Select an answer for whether the deceased ever paid for any insurance policies that were not due to pay out to their estate	Dewiswch ateb ar gyfer a dalodd yr ymadawedig am unrhyw bolisïau yswiriant nad oedd disgwyl iddynt dalu allan i'w ystâd/hystâd	Unchanged.
iht.registration.complete	Registration complete	Cofrestriad wedi'i gwblhau	Unchanged.
error.funeralExpenses.currencyValue.length.summary	enter a value for funeral costs using less than 11 numbers	Nodwch werth ar gyfer costau angladd gan ddefnyddio llai na 11 rhif	Unchanged.
iht.address.lowerCaseInitial	address	cyfeiriad	Unchanged.
iht.complete	Complete	Cwblhau	Unchanged.
error.applicantProbateLocation.select	Select where you are applying for probate	Dewiswch ymhle'r ydych yn gwneud cais am Brofiant	Unchanged.
iht.estateReport.exemptions.spouse.assetLeftToSpouse.question	Did {0} leave any assets to their spouse or civil partner?		Unchanged.
error.dateOfMarriage.blank.summary	enter a date of marriage or civil partnership	nodwch ddyddiad priodi neu ffurfio partneriaeth sifil	Unchanged.
error.giftsDetails.exceedsLimit	Give an exemption value of £14,000 or less	Rhowch werth eithriad sy'n £14,000 neu'n llai	Unchanged.
site.link.giveAValue	Give a value	Rhowch werth	Unchanged.
page.iht.application.estateOverview.increaseThreshold.notAvailable	Not available		Unchanged.
error.deceasedIsAddressInUK.select	Select an answer for where the deceased’s contact address was		Unchanged.
page.iht.application.exemptions.assetsLeftToQualifyingBody.help.contents	You should check with the body. They will be able to tell you if assets they receive will be an Inheritance Tax exemption.		Unchanged.
site.currentPage	This is the current page	Dyma'r dudalen bresennol	Unchanged.
error.applicant.insufficientCoExecutors	Add details of the other person applying for probate	Ychwanegu manylion y person arall sy'n gwneud cais am Brofiant	Unchanged.
page.iht.registration.applicantDetails.role.label	Your role	Eich swyddogaeth	Unchanged.
error.debts.debtsOutsideUk.select	Select an answer for if {0} owed any debts to anyone outside of the UK		Unchanged.
page.iht.application.exemptions.overview.charity.detailsOverview.title	Add a UK charity		Unchanged.
error.otherAsset.currencyValue.summary	enter a value for other assets owned using only numbers	nodwch werth ar gyfer asedion eraill gan ddefnyddio rhifau'n unig	Unchanged.
page.iht.application.exemptions.assetsLeftToQualifyingBody.p1	These are all of the assets being left to a qualifying body.		Unchanged.
error.debts.funeralExpenses.select	Select an answer for if there are any funeral expenses being paid out of the estate	Dewiswch ateb ar gyfer os oes unrhyw dreuliau angladd sy'n cael eu talu gan yn yr ystâd	Unchanged.
page.iht.application.exemptions.partner.name.lastName.label	Last name of spouse or civil partner		Unchanged.
iht.estateReport.exemptions.qualifyingBodies.confirmDeleteQualifyingBody	Confirm that you want to delete this qualifying body		Unchanged.
iht.estateReport.exemptions.charities.returnToAddACharity	Return to add a charity		Unchanged.
iht.estateReport.goToEstateReports	Go to your Inheritance Tax estate reports		Unchanged.
page.iht.registration.checklist.applicant.reveal.label1	The location where you are planning to apply to the Probate Service is where you are sending your PA1 - Probate application form. There are different places throughout the UK but you can only use this service if you are planning to apply in England or Wales.		Unchanged.
error.value.blank	A value should be entered	Dylid nodi gwerth.	Unchanged.
error.currency.assets.policies.summary	enter a value for insurance policies using only numbers	nodwch werth ar gyfer polisïau yswiriant gan ddefnyddio rhifau'n unig	Unchanged.
iht.roughEstimateEstateWorth	Using an estimate of any houses or money in bank accounts that the deceased might’ve owned, how much do you think the deceased’s estate is worth?	Gan ddefnyddio amcangyfrif o unrhyw arian neu dai mewn cyfrifon banc a all yr ymadawedig fod yn berchen arnno/arnynt, yn eich barn chi faint yw gwerth ystâd yr ymadawedig?	Unchanged.
page.iht.application.exemptions.assetLeftToPartner.sectionName	asset-left-to-partner		Unchanged.
page.iht.application.exemptions.overview.qualifyingBody.detailsOverview.name.link.screenreader.noValue	Give the name of the qualifying body		Unchanged.
page.iht.application.exemptions.qualifyingBody.value.browserTitle	Value of assets left to body		Unchanged.
page.iht.application.exemptions.assetLeftToGncp.question1.hint	You should add each individual body that received assets and tell us the total value of what they received.		Unchanged.
page.iht.registration.applicantDetails.utr.hint	It is a 10 digit number allocated by HMRC if you have completed a self-assessment tax return		Unchanged.
page.iht.application.overview.gifts.screenReader.value.link	View or change gifts given away		Unchanged.
iht.registration.kickout.returnToTheLastPageVisited	return to the last page you visited	dychwelyd i'r dudalen ddiwethaf y gwnaethoch ymweld â hi	Unchanged.
page.iht.application.debts.overview.debtsFromTrust.screenReader.link.value	Change the value of debts owed from a trust		Unchanged.
page.iht.registration.applicantDetails.email.label	Your email address	Eich cyfeiriad e-bost	Unchanged.
page.iht.registration.multipleExecutors.title	Add more {0}s	Ychwanegu rhagor o {0}	Unchanged.
error.address.invalid.character	This line contains an invalid character. Valid characters are: A-Z a-z 0-9 - ’ , / & space		Unchanged.
page.iht.registration.checklist.deceased.reveal.label2	The last known contact address is where they had their post sent before they died. This could be to a home that they owned or where they last lived.	Y cyfeiriad cyswllt hysbys olaf yw'r man lle'r oedd yn cael ei bost/phost cyn marw. Gallai hynny fod yn gartref yr oedd yn berchen arno, neu'r man diwethaf lle'r oedd yn byw.	Unchanged.
error.heldInTrust.currencyValue.summary	enter a value for assets in a trust using only numbers	nodwch werth ar gyfer asedion mewn ymddiriedolaeth gan ddefnyddio rhifau'n unig	Unchanged.
error.phoneNumber.giveUsingOnlyLettersAndNumbers	Give a phone number only using numbers or letters	Rhowch rif ffôn gan ddefnyddio llythrennau a rhifau'n unig	Unchanged.
error.hasCheckedEverything.select	Select an answer for if you have finished finding out about the estate	Dewiswch ateb ar gyfer a ydych wedi gorffen dod i wybod am yr ystâd	Unchanged.
page.iht.application.exemptions.guidance.increasing.threshold.link.text	Go to estate exemptions		Unchanged.
page.iht.application.return.to.exemptionsOf	Return to {0}’s estate exemptions		Unchanged.
page.iht.application.overview.closed.warning	By completing clearance you are confirming that you have nothing left to do with this estate. HMRC will give you a certificate that you can download or print and which confirms that this estate report has been cleared.		Unchanged.
page.iht.application.debts.overview.debtsOutsideUk.screenReader.link.value	Change the value of debts owed to anyone outside of the UK		Unchanged.
error.currencyValue.length.summary	enter a value using less than 11 numbers	nodwch werth gan ddefnyddio llai nag 11 rhif	Unchanged.
site.nameDetails	{0}’s details		Unchanged.
page.iht.registration.co-executor-personal-details.title	Personal details for the other executor		Unchanged.
iht.estateReport.exemptions.title	Estate exemptions		Unchanged.
iht.estateReport.exemptions.charities.assetsLeftToACharity.title	Assets left to a charity		Unchanged.
page.iht.application.timeout.p2	You will need to sign back in to Government Gateway and then choose what you want to do next from your Inheritance Tax estate reports page.		Unchanged.
page.iht.registration.registrationSummary.coExecutorTable.nino.link.screenReader	Change {0}'s national insurance number	Newid rhif Yswiriant Gwladol {0}	Unchanged.
page.iht.registration.completedRegistration.p2.bullet2	give details about what the deceased owned as well as any debts being paid from their estate	rhoi manylion ynghylch yr hyn yr oedd yr ymadawedig yn berchen arno yn ogystal ag unrhyw ddyledion sy'n cael eu talu o'i ystâd/hystâd	Unchanged.
page.iht.registration.checklist.exec.reveal.label1	The easiest thing to do is to ask the person who you are adding for their details. They will be able to find their National Insurance number on a payslip, a P45 or a P60 form.		Unchanged.
error.isJointAssetPassed.select	Select an answer for if all of the jointly owned assets passed from, the estate to the deceased	Dewiswch ateb ar gyfer os trosglwyddwyd yr asedion mewn perchnogaeth ar y cyd o'r ystâd i gyd i'r ymadawedig	Unchanged.
pdf.exemption.otherQualifyingBodies	Other qualifying bodies		Unchanged.
error.funeralExpenses.currencyValue.summary	enter a value for funeral costs using only numbers	nodwch werth ar gyfer costau angladd gan ddefnyddio rhifau'n unig	Unchanged.
page.iht.application.exemptions.charityDelete.sectionTitle	Confirm that you want to delete this charity		Unchanged.
site.changeInput	Change value	Newid gwerth	Unchanged.
error.isPartnerLivingInUk.select	Select an answer for if the spouse or civil partner had their permanent home in the UK	Dewiswch ateb ar gyfer os yw cartref parhaol y priod neu bartner sifil yn y DU	Unchanged.
page.iht.registration.deleteExecutor.browserTitle	Delete applicant	Dileu'r person sy'n gwneud cais	Unchanged.
page.iht.registration.checklist.applicant.label4	choice of country for where you are applying to the Probate Service – only people applying in England and Wales can use this service		Unchanged.
iht.country	Country	Gwlad	Unchanged.
page.iht.iv.failure.timeout.p2	We have deleted all the details you have entered for your own security.		Unchanged.
error.dateOfBirth.giveNoneFuture	Give a date of birth that is not in the future	Rhowch ddyddiad geni nad yw yn y dyfodol	Unchanged.
page.iht.registration.executor-overview.sectionName	executor-overview	executor-overview	Unchanged.
page.iht.application.exemptions.assetLeftToGncp.screenReader.link.noValue	Give a value for assets left to another qualifying body		Unchanged.
page.iht.application.estateOverview.totalAddedToTheEstateValue	Total added to the estate value		Unchanged.
page.iht.application.exemptions.overview.charity.screenReader.link.value	Change the value for assets left to charities		Unchanged.
page.iht.registration.applicantDetails.phoneNo.label	Your phone number	Eich rhif ffôn	Unchanged.
pdf.totalexemptions.text	Total Exemptions		Unchanged.
iht.delete	Delete	Dileu	Unchanged.
page.iht.application.exemptions.overview.qualifyingBody.detailsOverview.value.link.screenreader.value	Change the value of assets received by the qualifying body		Unchanged.
iht.registration.contactAddress	Contact address	Cyfeiriad cyswllt	Unchanged.
page.iht.application.exemptions.charityNumber.linkText	searching the charity register		Unchanged.
page.iht.application.overview.debts.screenReader.noValue.link	Start giving details about debts owed from the estate		Unchanged.
page.iht.application.debts.debtsTrust.browserTitle	Debts owed from trust		Unchanged.
page.iht.application.overview.inreview.title	This estate report is being reviewed by HMRC		Unchanged.
site.button.save.return.debts	Save and return to debts owed from the estate	Cadw ac yn ôl i ddyledion sydd ar yr ystâd	Unchanged.
page.iht.registration.applicantDetails.countrycode.help	If your address is not in the UK		Unchanged.
iht.estateReport.debts.debtsTrust.value	Value of any debts owed from a trust		Unchanged.
page.iht.home.title	Your Inheritance Tax estate reports		Unchanged.
site.button.confirm	Confirm	Cadarnhau	Unchanged.
site.link.return.insurance.policies	Return to insurance policies	Yn ôl i bolisïau yswiriant	Unchanged.
page.iht.registration.others-applying-for-probate-address.browserTitle	Other person’s address		Unchanged.
page.iht.application.exemptions.assetLeftToGncp.screenReader.noValue	No value given for assets left to another qualifying body		Unchanged.
site.button.signOut	Save and sign out	Cadw ac allgofnodi	Unchanged.
iht.needHelp	Need help?		Unchanged.
page.iht.registration.notApplyingForProbate.kickout.summary	This is because you are not applying for probate for {0}’s estate.		Unchanged.
page.iht.application.debts.funeralExpenses.description.p2	If {0} paid for a funeral plan before they died, this would not be a funeral expense. Any travelling or accommodation costs for mourners, or any flowers or refreshments that they gave, cannot be claimed as a funeral expense.		Unchanged.
page.iht.registration.registrationSummary.coExecutorTable.others-are-applying.link.screenReader	and add or remove another person	ac ychwanegwch neu dilëwch berson arall	Unchanged.
iht.estateReport.correctiveAccountForm	Corrective Account form		Unchanged.
page.iht.iv.failure.timeout.title	Your session has ended due to inactivity		Unchanged.
page.iht.registration.checklist.deceased.title	You will need the person who has died’s:		Unchanged.
page.iht.registration.deceasedDetails.maritalStatus.single.label	Never married or in a civil partnership	Heb fod yn briod na mewn partneriaeth sifil ar unrhyw adeg	Unchanged.
page.iht.iv.failure.2fa.p2	When you want to sign in to securely use Inheritance Tax Online, you should set up 2-step verification.		Unchanged.
page.iht.application.exemptions.overview.charity.detailsOverview.browserTitle	Add charity		Unchanged.
error.moneyOwed.currencyValue.summary	enter a value for money owed using only numbers	nodwch werth ar gyfer arian sy'n ddyledus gan ddefnyddio rhifau'n unig	Unchanged.
page.iht.registration.registrationSummary.focusElement.prefix	focusElementId	focusElementId	Unchanged.
iht.dropdown.selected	{0} selected		Unchanged.
iht.back	Back	Nôl	Unchanged.
page.iht.application.exemptions.partner.nino.sectionTitle	What is the spouse’s or civil partner’s National Insurance number?		Unchanged.
iht.firstName	First name	Enw cyntaf	Unchanged.
page.iht.registration.others-applying-for-probate.sectionTitle	Are there any other executors applying for probate for this estate?		Unchanged.
iht.registration.deceased.permanentHome.where.question	Where did the deceased have their permanent home?	Ymhle'r oedd cartref parhaol yr ymadawedig?	Unchanged.
page.iht.application.charity.name.screenReader	The name of this charity is {0}		Unchanged.
