page.iht.application.overview.cleared.helptext2	You can view a copy of your clearance certificate that confirms that this estate report has been cleared.		Unchanged.
site.link.return.mortgage	Add a mortgage value for a property, building or land	Ychwanegu gwerth morgais ar gyfer eiddo, adeilad neu dir	Unchanged.
error.postcode.incorrect.summary	enter a valid postcode	nodwch god post dilys	Unchanged.
error.dateOfBirth.numeric	Enter a valid date of birth using only numbers	Nodwch ddyddiad geni dilys gan ddefnyddio rhifau'n unig	Unchanged.
iht.estateReport.exemptions.partner.homeInUK.question	Is the spouse’s or civil partner’s permanent home in the UK?		Unchanged.
page.iht.application.debts.overview.total	Total value of debts owed from the estate		Unchanged.
page.iht.application.debts.overview.funeralExpenses.screenReader.link.moreDetail	Give more details about funeral expenses		Unchanged.
error.blank.assets.properties.typeOfOwnership.summary	select how this property was owned	dewiswch sut y perchenogwyd yr eiddo	Unchanged.
page.iht.home.button.startApplication.screenReader	Start {0}’s estate report		Unchanged.
page.iht.registration.registrationSummary.deceasedInfo.dateOfBirth.link.screenReader	Change {0}’s date of birth		Unchanged.
site.link.return.vehicles	Return to motor vehicles	Yn ôl i gerbydau modur	Unchanged.
iht.estateReport.exemptions.charities.charityName.title	Charity name		Unchanged.
page.iht.application.estateOverview.valueOfAssetsAndGifts	Value of assets and gifts		Unchanged.
page.iht.registration.registrationSummary.coExecutorTable.address.link.screenReader	Change {0}'s address	Newid cyfeiriad {0}	Unchanged.
page.iht.registration.checklist.label3	It should take you no more than 30 minutes to finish all of registration.	Ni ddylai gymryd mwy na 30 munud i chi orffen y broses gofrestru gyfan.	Unchanged.
page.iht.registration.applicantDetails.kickout.probateRole.summary	This is because you are not intending to apply for probate in England or Wales and you are not an executor or an administrator for the deceased’s estate.		Unchanged.
site.button.details.correct	The details given are correct	Mae'r manylion a roddwyd yn gywir	Unchanged.
page.iht.application.exemptions.overview.charity.screenReader.link.moreDetail	Give more details for assets left to charities		Unchanged.
iht.inReview	In review		Unchanged.
page.iht.application.exemptions.overview.partner.homeInUK.screenreader.link.value	Change the answer for is the spouse’s or civil partner’s permanent home in the UK		Unchanged.
iht.dropdown.matches	{0} matches found. Use arrow keys or swipe to navigate the list		Unchanged.
iht.estateReport.exemptions.partner.assetsLeftToSpouse.title	Assets left to a spouse or civil partner		Unchanged.
page.iht.application.overview.common.helptext.part2	Only do this if these assets increase the value of the estate over the Inheritance Tax threshold.		Unchanged.
page.iht.registration.checklist.applicant.reveal.label3	The phone number you give is one that HMRC can contact you on. This might happen after you have finished the estate report and it is being reviewed.	Y rhif ffôn a rowch yw'r un y gall CThEM gysylltu â chi arno. Gallai hynny ddigwydd ar ôl i chi orffen adroddiad yr ystâd a'i fod yn cael ei adolygu.	Unchanged.
iht.iv.contactHMRC	contact HMRC to get help	cysylltwch â CThEM er mwyn cael help	Unchanged.
page.iht.application.exemptions.guidance1	These are assets that are exempt from Inheritance Tax and deducted from the value of the estate.		Unchanged.
page.iht.application.exemptions.qualifyingBodyOverview.lede	These are all of the assets being left to a qualifying body. These will not be charities that have a registered qualifying body number.		Unchanged.
error.charityName.enterName	Enter the name of the charity	Nodwch enw'r elusen	Unchanged.
error.assets.household.deceasedOwned.select	Select an answer for whether there are any household and personal items in the estate	Dewiswch ateb ar gyfer a oes nwyddau'r tŷ a nwyddau personol yn yr ystâd	Unchanged.
error.cannotSend	The details you have entered could not be sent at the moment.	Ar hyn o bryd ni ellir anfon y manylion yr ydych wedi'u nodi.	Unchanged.
page.iht.application.overview.time.limit2	to send your estate report.		Unchanged.
site.headers.overview.action	Action	Gweithred	Unchanged.
page.iht.registration.executor-overview.othersApplyingStatement.are	There are other people applying for probate	Mae yna bobl eraill sy'n gwneud cais am Brofiant	Unchanged.
page.iht.application.debts.overview.other.screenReader.value	The value of any other debts not listed is £{0}		Unchanged.
iht.notStarted.screenreader	{0} is not started	Mae {0} heb ddechrau	Unchanged.
page.iht.registration.duplicateRegistration.title	You have already registered these details	Rydych eisoes wedi cofrestru'r manylion hyn	Unchanged.
page.iht.registration.deceasedAddressQuestion.p1	This is the last address where {0} could have been contacted before they died.		Unchanged.
page.iht.registration.applicantTellUsAboutYourself.value.label	What is your phone number?	Beth yw'ch rhif ffôn?	Unchanged.
site.button.continue.iht.app.page	Continue to your Inheritance Tax estate reports page	Ymlaen i'ch tudalen adroddiadau ystâd o ran Treth Etifeddiant	Unchanged.
error.deceasedDateOfBirth.giveBeforeDateOfDeath	Give a date of birth that is before the date of death	Rhowch ddyddiad geni sydd cyn dyddiad y farwolaeth	Unchanged.
page.iht.application.charity.add.name	Name of charity		Unchanged.
error.giftsDetails.noValue	You must give the total value of gifts given away during this period	Mae'n rhaid i chi roi cyfanswm gwerth y rhoddion a roddwyd i ffwrdd yn ystod y cyfnod hwn	Unchanged.
iht.date.year	Year		Unchanged.
page.iht.application.exemptions.partner.totalAssets.browserTitle	Value of assets left to partner		Unchanged.
site.noAssetsLeft	No assets left	Dim asedion ar ôl	Unchanged.
page.iht.registration.registrationSummary.deceasedInfo.nino.link.screenReader	Change {0}’s national insurance number		Unchanged.
iht.estateReport.exemptions.qualifyingBodies.assetsLeftToQualifyingBody.p3	Other qualifying bodies could include a community amateur sports club or charities outside of the UK.		Unchanged.
page.iht.registration.completedRegistration.p2.bullet1	save your progress and return whenever you want	cadw'ch cynnydd a dychwelyd pryd bynnag yr ydych eisiau	Unchanged.
page.iht.application.exemptions.assetLeftToGncp.sectionTitle	Assets left to another qualifying bodies		Unchanged.
site.link.giveDate	Give date	Rhowch ddyddiad	Unchanged.
iht.registration.checklist.phoneNo.lowerCaseInitial	phone number	Rhif ffôn	Unchanged.
page.iht.application.exemptions.qualifyingBodyOverview.question.screenreader.link	Change the answer to did {0} leave anything to a qualifying body		Unchanged.
iht.timeout.p1	For your security, we signed you out because you didn’t continue the service for 30 minutes or more.	Er eich diogelwch, rydym wedi'ch allgofnodi oherwydd ni ddefnyddiwyd y gwasanaeth am 30 munud neu fwy.	Unchanged.
iht.ninoExample	For example, QQ 12 34 56 C	Er enghraifft, QQ 12 34 56 C	Unchanged.
error.dateOfMarriage.giveCorrectDay	Give a correct day of marriage using numbers 1 to 31	Rhowch ddiwrnod cywir ar gyfer priodi gan ddefnyddio'r rhifau 1 i 31	Unchanged.
page.iht.registration.registrationSummary.coExecutorTable.dateOfBirth.link.screenReader	Change {0}'s date of birth	Newid dyddiad geni {0}	Unchanged.
page.iht.application.estateOverview.increaseThreshold.link	I want to transfer the unused allowance from someone else’s estate		Unchanged.
page.iht.application.debts.overview.debtsOutsideUk.screenReader.link.moreDetail	Give more detail about debts owed to anyone outside of the UK		Unchanged.
site.changeDate	Change date	Newid dyddiad	Unchanged.
error.vehicles.currencyValue.summary	enter a value for motor vehicles using only numbers	nodwch werth ar gyfer cerbydau modur gan ddefnyddio rhifau'n unig	Unchanged.
global.error.pageNotFound404.title	Page not found - 404	Heb ddod o hyd i'r dudalen – 404	Unchanged.
site.copyApplication.link	copy of the application	copi o'r cais	Unchanged.
page.iht.application.exemptions.qualifyingBody.value.sectionTitle	Total value of all assets left to the qualifying body		Unchanged.
page.iht.application.debts.subtitle2	You need a grant of representation from the Probate Service to pay some debts off from the estate and sometimes the value of debts owed can be taken off the total estate value.		Unchanged.
page.iht.application.exemptions.overview.charity.detailsOverview.number.screenreader.link.value	Change the registered charity number		Unchanged.
error.isAssetForCharity.select	Select an answer for if any assets have been left to a charity	Dewiswch ateb ar gyfer os oes asedion wedi'u gadael i elusen	Unchanged.
site.link.go.to.gifts	Go to the gifts given away by the deceased section	Ewch i'r adran rhoddion a roddwyd i ffwrdd gan yr ymadawedig	Unchanged.
page.iht.registration.registrationSummary.deceasedInfo.title.id	title	teitl	Unchanged.
error.otherDebt.currencyValue.length.summary	enter a value for other debts using less than 11 numbers	nodwch werth ar gyfer dyledion eraill gan ddefnyddio llai nag 11 rhif	Unchanged.
error.qualifyingBodyName.giveUsing35CharactersOrLess	Give the name of the other qualifying body using 35 characters or less	Rhowch enw'r corff cymwys arall gan ddefnyddio 35 cymeriad neu lai	Unchanged.
error.charityNumber.enterUsingOnly6Or7Numbers	Enter the correct charity number using only 6 or 7 numbers	Nodwch rif cywir yr elusen gan ddefnyddio 6 neu 7 rhif yn unig	Unchanged.
error.blank.qualifyingBody.name.summary	enter the name of who received assets	nodwch enw'r sawl a gafodd asedion	Unchanged.
page.iht.application.overview.gifts.screenReader.noValue	You have not entered any gifts given away		Unchanged.
error.address.length	Enter an address of less than 36 characters	Nodwch gyfeiriad sy'n cynnwys llai na 36 cymeriad	Unchanged.
page.iht.application.overview.gifts.screenReader	The value of gifts given away is £{0}		Unchanged.
page.iht.application.exemptions.assetsLeftToQualifyingBody.sectionTitle	Did {0} leave any assets to another qualifying body?		Unchanged.
page.iht.registration.applicantDetails.role.administrator.label	Administrator	Gweinyddwr	Unchanged.
page.iht.registration.applicantDetails.utr.label	Your Unique Tax Reference (UTR) number (optional)	Eich Cyfeirnod Unigryw y Trethdalwr (UTR) (opsiynol)	Unchanged.
iht.registration.kickout.message.form2	If you want to change this date	Os ydych am newid y dyddiad hwn	Unchanged.
page.iht.application.probateDetails.content2.bullet1	your IHT Identifier is		Unchanged.
page.iht.application.exemptions.partner.nino	National Insurance number of spouse or civil partner		Unchanged.
page.iht.application.exemptions.overview.qualifyingBody.detailsOverview.name.link.screenreader.value	Change the qualifying body name		Unchanged.
page.iht.application.qualifyingbodies.edit.screenReader	Change any of the details you have given for {0} (qualifying body {1})		Unchanged.
iht.registration.kickout.message.phone	Call the Inheritance Tax helpline on 0300 123 1072. If you are outside of the UK, call +44 300 123 1072.		Unchanged.
iht.inComplete	Incomplete	Heb ei gyflawni	Unchanged.
iht.useIHT400PaperForm	You must use an IHT-400 paper form	Mae'n rhaid i chi ddefnyddio ffurflen bapur IHT-400	Unchanged.
page.iht.registration.deceasedDetails.maritalStatus.hint	Select the status that applied to the deceased only when they died	Dewiswch y statws a oedd yn gymwys ar gyfer yr ymadawedig dim ond pan fu farw	Unchanged.
page.iht.application.overview.tnrb.screenReader.link	View or change details for increasing the threshold		Unchanged.
error.dateOfBirth.incorrect	Enter a valid date of birth	Nodwch ddyddiad geni dilys	Unchanged.
error.address.give	Give an address	Rhowch gyfeiriad	Unchanged.
page.iht.application.exemptions.guidance.content4	The estate value could become less than the Inheritance Tax threshold by claiming these exemptions.		Unchanged.
global.error.pageNotFound404.heading	This page cannot be found		Unchanged.
page.iht.home.applicationList.table.guidance.label.empty	You have not registered to complete an Inheritance Tax estate report.		Unchanged.
page.iht.registration.applicant.applyingForProbate.p1	If you are applying for probate, you will also be filling in a PA1 - Probate application form.		Unchanged.
error.isEstateBelowIhtThresholdApplied.select	Select an answer for if all of the estate passed to the deceased. a charity or another qualifying body	Dewiswch ateb ar gyfer os trosglwyddwyd yr ystâd i gyd i'r ymadawedig, elusen neu gorff cymwys arall	Unchanged.
iht.inProgress	In progress		Unchanged.
page.iht.application.exemptions.overview.partner.assetsLeftForPartner.screenreader.link.noValue	Give answer for did {0} leave anything to their spouse or civil partner		Unchanged.
page.iht.application.exemptions.assetLeftToCharity.question1.hint	You should add each individual charity that received assets and tell us the total value of what they received.		Unchanged.
error.nino.giveUsing8Or9Characters	Give a valid National Insurance number using 8 or 9 characters	Rhowch rif Yswiriant Gwladol dilys gan ddefnyddio 8 neu 9 cymeriad	Unchanged.
page.iht.registration.checklist.deceased.reveal.label1	The person who has died’s first and last name will be on the death certificate. If you did not know the person who has died, ask their family or friends for some details if you do not have them.		Unchanged.
iht.estateReport.exemptions.charities.assetLeftToCharity.question	Did {0} leave any assets to a charity?		Unchanged.
page.iht.application.exemptions.assetLeftToGncp.description.p2	Other qualifying bodies might be a museum or a community amateur sports club.		Unchanged.
error.assets.privatePensions.deceasedOwned.select	Select an answer for whether there are any private pensions in the estate	Dewiswch ateb ar gyfer a oes unrhyw bensiynau preifat yn yr ystâd	Unchanged.
page.iht.application.probateDetails.yourProbateText	For your PA1 - Probate application form:		Unchanged.
iht.ifYouWantToChangeYourAnswer	If you want to change your answer	Os oes angen i chi newid eich ateb	Unchanged.
error.charityName.giveUsing35CharactersOrLess	Give a charity name using 35 characters or less	Rhowch enw elusen gan ddefnyddio 35 cymeriad neu lai	Unchanged.
page.iht.application.debts.other.description.p3	Any outstanding credit card debts and money owed on any insurance policies and household bills are included here.		Unchanged.
page.iht.registration.registrationSummary.deceasedInfo.dateOfDeath.link.screenReader	Change {0}’s date of death		Unchanged.
site.return.inheritance.tax.estate.report.link	Return to Your Inheritance Tax estate reports	Yn ôl i'ch adroddiadau ystâd o ran Treth Etifeddiant	Unchanged.
page.iht.iv.failure.technicalIssue.p3	If you have a query,		Unchanged.
page.iht.application.exemptions.overview.partner.nino.title	National Insurance number of the spouse or civil partner		Unchanged.
page.iht.registration.checklist.applicant.reveal.label2	If the person who has died left a will then you will know if you are an executor of their estate as you will be named in it. If there is no will, the court will have named you as an administrator.		Unchanged.
page.iht.application.exemptions.deleteGNCP.screenReader	The name of the qualifying body you may wish to delete is {0}		Unchanged.
page.iht.registration.registrationSummary.coExecutorTable.phoneNumber.link.screenReader	Change {0}’s phone number		Unchanged.
error.address.blank	Enter an address	Nodwch gyfeiriad	Unchanged.
error.length.giftsDetails.value	Enter a value using less than 11 numbers	Nodwch werth gan ddefnyddio llai nag 11 rhif	Unchanged.
site.noCharityNameGiven	No charity name given	Ni roddwyd enw elusen	Unchanged.
page.iht.registration.applicantAddress.title	Your address	Eich cyfeiriad	Unchanged.
global.error.InternalServerError500.title	We are experiencing technical difficulties		Unchanged.
page.iht.registration.co-executor-personal-details.isAddressInUk	Is their address in the UK?	A yw cyfeiriad y person hwnnw yn y DU?	Unchanged.
error.postcode.invalid.character	This line contains an invalid character. Valid characters are: A-Z a-z 0-9 space	Mae'r llinell hon yn cynnwys cymeriad annilys. Dyma'r cymeriadau dilys: A-Z a-z 0-9 bwlch	Unchanged.
iht.estateReport.exemptions.charities.charityNo.question	What is the registered charity number?		Unchanged.
error.debts.trusts.select	Select an answer for if there are any debts from a trust that {0} benefitted from		Unchanged.
iht.registration.kickout.returnToTheDateOfDeath	return to the date of death	dychwelyd i ddyddiad y farwolaeth	Unchanged.
error.deceasedMaritalStatus.select	Select the deceased’s relationship status		Unchanged.
error.length.assets.policies.summary	enter a value for insurance policies using less than 11 numbers	nodwch werth ar gyfer polisïau yswiriant gan ddefnyddio llai nag 11 rhif	Unchanged.
page.iht.home.deceasedName.label	Person who has died		Unchanged.
page.iht.registration.deceasedPermanentHome.title	Where was the person who has died’s permanent home?		Unchanged.
iht.date.day	Day		Unchanged.
iht.address.line4	Address line 4 (optional)	Cyfeiriad – llinell 4 (dewisol)	Unchanged.
page.iht.application.exemptions.assetsLeftToQualifyingBody.p2	These are not charities with a registered charity number.		Unchanged.
page.iht.application.qualifyingbodies.name.screenReader	The name of this qualifying body is {0}		Unchanged.
site.link.cancel	Cancel	Canslo	Unchanged.
site.link.return.assets	Return to assets in the estate	Yn ôl i asedion yn yr ystâd	Unchanged.
page.iht.registration.registrationSummary.coExecutorTable.phoneNumber.data.screenReader	{0}’s phone number is {1}		Unchanged.
page.iht.application.debts.overview.funeralExpenses.screenReader.link.noValue	Give a value for funeral expenses		Unchanged.
page.iht.application.exemptions.guidance.increasing.threshold.p2	Some of the deceased’s assets can be claimed as an exemption if they are being passed to a spouse or civil partner, a charity or to another qualifying body.		Unchanged.
error.isStateClaimAnyBusiness.select	Select an answer for if the estate claimed any business or agricultural relief	Dewiswch ateb ar gyfer os wnaeth yr ystâd cais am ryddhad busnes neu ryddhad amaethyddol	Unchanged.
page.iht.registration.notApplyingForProbate.kickout.p2	If you want to change your answer, you can return to the last page you visited.	Os ydych am newid eich ateb, gallwch ddychwelyd i'r dudalen ddiwethaf y gwnaethoch ymweld â hi	Unchanged.
error.dateOfMarriage.giveCorrectDayForMonth	Give the correct date of marriage using the correct number of days for that month	Rhowch y dyddiad cywir ar gyfer priodi gan ddefnyddio'r nifer cywir o ddyddiau ar gyfer y mis hwnnw	Unchanged.
error.dateOfBirth.giveCorrectDayForMonth	Give the correct date of birth using the correct number of days for that month	Rhowch y diwrnod geni cywir gan ddefnyddio'r nifer cywir o ddyddiau ar gyfer y mis hwnnw	Unchanged.
error.dateOfDeath.giveCorrectDay	Give a correct day of death using numbers 1 to 31	Rhowch ddiwrnod cywir ar gyfer y farwolaeth gan ddefnyddio'r rhifau 1 i 31	Unchanged.
iht.date.month	Month		Unchanged.
page.iht.registration.deceasedDetails.postcode.help	If the deceased’s contact address is in the UK		Unchanged.
iht.registration.applicant.applyingForProbate	Are you applying for probate for the estate?		Unchanged.
page.iht.iv.failure.failedMatching.title	We were unable to confirm your identity		Unchanged.
page.iht.registration.registrationSummary.applicantInfo.applyingForProbate.data.screenReader	Your answer is {0}	{0} yw'ch ateb	Unchanged.
iht.countries.scotland	Scotland	Yr Alban	Unchanged.
page.iht.application.exemptions.assetLeftToGncp.sectionName	asset-left-to-gncp		Unchanged.
page.iht.application.overview.debts.screenReader	The value of debts owed from the estate is £{0}		Unchanged.
iht.ifYouWantToChangeValue	If you want to change the value	Os oes angen i chi newid y gwerth	Unchanged.
page.iht.application.debts.funeralExpenses.description.p1	You can deduct some funeral expenses. Things that could be claimed as an expense are flowers, refreshments for mourners and any necessary expenses to cover the funeral arrangements and the cost of a headstone or plaque to mark the grave. This will come out of the estate as a debt.		Unchanged.
error.properties.blank.summary	enter the value of this property	nodwch werth yr eiddo hwn	Unchanged.
page.iht.registration.registrationSummary.coExecutorTable.none	You are the only person applying for probate	Chi yw'r unig berson sy'n gwneud cais am Brofiant	Unchanged.
page.iht.registration.registrationSummary.applicantInfo.role.label	Role	Swyddogaeth	Unchanged.
iht.signInAgain	Sign back in and return to your Inheritance Tax estate reports page		Unchanged.
page.iht.iv.failure.timeout.p1	Your session has ended because you have not done anything for 30 minutes.		Unchanged.
error.phoneNumber.give	Give a phone number	Rhowch rif ffôn	Unchanged.
page.iht.application.exemptions.qualifyingBodyOverviewTable.header	Qualifying bodies		Unchanged.
iht.registration.deceased.locationOfPermanentHome	Location of permanent home		Unchanged.
error.selectAnswer.summary	select an answer	dewiswch ateb	Unchanged.
page.iht.application.overview.common.helptext.part1	If you find any more assets owned by {0} that were not included in this estate report, let HMRC know by using a		Unchanged.
iht.valueOfDebts	Value of debts		Unchanged.
error.nominated.currencyValue.summary	enter a value for nominated assets using only numbers	nodwch werth ar gyfer asedion enwebedig gan ddefnyddio rhifau'n unig	Unchanged.
iht.theDeceased	The deceased		Unchanged.
page.iht.registration.registrationSummary.coExecutorTable.changeOthersApplying.link	Add or delete another person applying for probate	Ychwanegu neu ddileu person arall sy'n gwneud cais am Brofiant	Unchanged.
page.iht.application.exemptions.partner.nino.browserTitle	Partner’s National Insurance number		Unchanged.
error.privatePension.currencyValue.length.summary	enter a value for pensions using less than 11 numbers	nodwch werth ar gyfer pensiynau gan ddefnyddio llai nag 11 rhif	Unchanged.
page.iht.application.exemptions.overview.charity.screenReader.link.noValue	Give an answer for assets left to charities		Unchanged.
site.button.details.correct.exitToGovK	The details given are correct – exit to GOV.UK		Unchanged.
global.error.InternalServerError500.link.gov-uk-iht.text	Continue to Inheritance Tax overview	Ymlaen i Drosolwg o Dreth Etifeddiant	Unchanged.
error.isAssetForDeceasedPartner.select	Select an answer for if any assets have been left to the deceased's spouse or civil partner	Dewiswch ateb ar gyfer os oes unrhyw asedion wedi'u gadael i briod neu bartner sifil yr ymadawedig	Unchanged.
page.iht.application.exemptions.overview.partner.dob.title	Date of birth of the spouse or civil partner		Unchanged.
page.iht.home.applicationList.table.guidance.label	These are all the Inheritance Tax estate reports you have registered.		Unchanged.
error.assets.nominated.select	Select an answer for whether there are any nominated assets in the estate	Dewiswch ateb ar gyfer a oes unrhyw asedion enwebedig yn yr ystâd	Unchanged.
iht.estateReport.assets.qualifyingBodyAdd	Add a qualifying body		Unchanged.
error.isPartnerGiftWithResToOther.select	Select an answer for if any gifts with the reservation of benefit were given to anyone apart from the deceased	Dewiswch ateb ar gyfer os rhoddwyd unrhyw roddion â budd amodol i unrhyw un ar wahân i'r ymadawedig	Unchanged.
error.nino.incorrect.summary	enter a valid National Insurance number	nodwch rif Yswiriant Gwladol dilys	Unchanged.
page.iht.registration.checklist.deceased.label5	last known contact address	cyfeiriad cyswllt hysbys olaf	Unchanged.
page.iht.application.overview.title	Application progress for {0} is now {1}		Unchanged.
iht.gov.url	https://www.gov.uk/inheritance-tax	https://www.gov.uk/inheritance-tax	Unchanged.
error.dateOfBirth.giveCorrectDateUsingOnlyNumbers	Give a correct date of birth only using numbers	Rhowch ddyddiad geni cywir gan ddefnyddio rhifau'n unig	Unchanged.
page.iht.application.overview.cleared.sidebartitle	You have completed clearance of this estate report.		Unchanged.
page.iht.application.exemptions.qualifyingBodyDelete.browserTitle	Delete qualifying body		Unchanged.
page.iht.application.exemptions.overview.partner.nino.screenreader.link.noValue	Give the National Insurance number of the spouse or civil partner		Unchanged.
page.iht.registration.checklist.applicant.label5	role in the person who has died’s estate – you can only use this service if you are responsible for the estate as an executor or an administrator		Unchanged.
page.iht.registration.completedRegistration.p1	You can start to complete the estate report by selecting it on the next page from the list of Inheritance Tax estate reports you have created.	Gallwch ddechrau llenwi'r adroddiad ystâd o ran Treth Etifeddiant drwy'i ddewis ar y dudalen nesaf o'r rhestr o adroddiadau ystâd o ran Treth Etifeddiant yr ydych wedi'i chreu	Unchanged.
page.iht.registration.registrationSummary.applicantInfo.phoneNumber.link.screenReader	Change your phone number	Newid eich rhif ffôn	Unchanged.
error.dateOfDeath.giveNoneFuture	Give a date of death that is not in the future	Rhowch ddyddiad ar gyfer y farwolaeth nad yw yn y dyfodol	Unchanged.
page.iht.application.exemptions.deceasedName.subtitle	{0}’s estate return		Unchanged.
error.dateOfDeath.giveCorrectYear	Give a correct year of death	Rhowch flwyddyn gywir ar gyfer y farwolaeth	Unchanged.
site.date-hint-text	For example, 31 12 2014	Er enghraifft, 31 12 2014	Unchanged.
site.noCharityNumberGiven	No charity number given	Ni roddwyd rhif elusen	Unchanged.
iht.estateReport.exemptions.charities.returnToAssetsLeftToCharities	Return to assets left to charities		Unchanged.
