iht.estateReport.exemptions.charities.assetLeftToCharity.question	Did {0} leave any assets to a charity?	A adawodd {0} unrhyw asedion i elusen?
page.iht.application.exemptions.overview.qualifyingBody.detailsOverview.value.title	Total value of assets received by the qualifying body	Cyfanswm yr asedion a gafwyd gan y corff cymwys
page.iht.application.exemptions.overview.qualifyingBody.screenReader.link.moreDetail	Give more details for assets left to other qualifying bodies	Rhowch ragor o fanylion ar gyfer asedion a adawyd i gyrff cymwys eraill
page.iht.application.exemptions.overview.qualifyingBody.screenReader.link.noValue	Give an answer for assets left to other qualifying bodies	Rhowch ateb ar gyfer asedion a adawyd i gyrff cymwys eraill
page.iht.application.exemptions.overview.qualifyingBody.screenReader.link.value	Change the value for assets left to other qualifying bodies	Newidiwch y swm ar gyfer asedion a adawyd i gyrff cymwys eraill
page.iht.application.exemptions.overview.qualifyingBody.screenReader.noValue	You have not given a value for assets left to other qualifying bodies	Nid ydych wedi rhoi swm ar gyfer asedion a adawyd i gyrff cymwys eraill
page.iht.application.exemptions.overview.qualifyingBody.screenReader.value	The value of assets left to other qualifying bodies is £{0}	Swm yr asedion a adawyd i gyrff cymwys eraill yw £{0}
page.iht.application.exemptions.qualifyingBody.name.browserTitle	Body name	Enw'r corff
page.iht.application.exemptions.qualifyingBody.name.sectionTitle	What is the qualifying body’s name?	Beth yw enw'r corff cymwys?
page.iht.application.exemptions.qualifyingBody.value.browserTitle	Value of assets left to body	Swm yr asedion a adawyd i'r corff
page.iht.application.exemptions.qualifyingBody.value.sectionTitle	Total value of all assets left to the qualifying body	Cyfanswm yr holl asedion a adawyd i'r corff cymwys
page.iht.application.exemptions.qualifyingBodyDelete.browserTitle	Delete qualifying body	Dilëwch gorff cymwys
page.iht.application.exemptions.qualifyingBodyOverview.browserTitle	Assets left to other bodies	Asedion a adawyd i gyrff eraill
page.iht.application.exemptions.qualifyingBodyOverview.lede	These are all of the assets being left to a qualifying body. These will not be charities that have a registered qualifying body number.	Dyma'r holl asedion sy'n cael eu gadael i gorff cymwys. Ni fydd y rhain yn elusennau sydd â rhif corff cymwys cofrestredig.
page.iht.application.exemptions.qualifyingBodyOverview.noQualifyingBodies.text	You have not added any qualifying bodies to this estate.	Nid ydych wedi ychwanegu unrhyw gyrff cymwys i'r ystâd hon.
page.iht.application.exemptions.qualifyingBodyOverview.question	Did {0} leave anything to a qualifying body?	A adawodd {0} unrhyw beth i gorff cymwys?
page.iht.application.exemptions.qualifyingBodyOverview.question.screenreader.link	Change the answer to did {0} leave anything to a qualifying body	Newidiwch yr ateb ar gyfer a adawodd {0} unrhyw beth i gorff cymwys
page.iht.application.exemptions.qualifyingBodyOverview.screenreader.ident	Qualifying body {0}.	Corff cymwys {0}.
page.iht.application.exemptions.qualifyingBodyOverviewTable.header	Qualifying bodies	Cyrff cymwys
page.iht.application.qualifyingbodies.add.subtitle	Add the name of the qualifying body and the total value of the assets received.	Ychwanegwch enw'r corff cymwys a chyfanswm yr asedion a gafwyd.
page.iht.application.qualifyingbodies.add.title	Assets left to another qualifying body	Asedion a adawyd i gorff cymwys arall
page.iht.application.qualifyingbodies.add.valuetext	Total value of assets the qualifying body received	Cyfanswm yr asedion a gafodd y corff cymwys
page.iht.application.qualifyingbodies.delete.screenReader	Delete {0} (qualifying body {1}) from your list of qualifying bodies	Dilëwch {0} (corff cymwys {1}) o'ch rhestr o gyrff cymwys
page.iht.application.qualifyingbodies.edit.screenReader	Change any of the details you have given for {0} (qualifying body {1})	Newidiwch unrhyw fanylion a roddwyd gennych ar gyfer {0} (corff cymwys {1})
page.iht.application.qualifyingbodies.name.screenReader	The name of this qualifying body is {0}	Enw'r corff cymwys hwn yw {0}
